id,name_en,bbx,caption_cn,caption_en,class_cn,class_en,retrieval_class_cn,retrieval_class_en,picture,scaling_strategy,inner_placement,portfolio_assets,source,author_name,author_link,license,state,alignToWallNormal
1447,a_SM_Fence_Helmet_01b,"0.290,0.316,0.198",橄榄绿色带网状纹理的军用头盔,Olive green military helmet with mesh netting texture,军用头盔,Military_helmet,军用头盔,Military_helmet,,RADIAL,0,0,https://www.fab.com/listings/77e58b77-87a8-4c97-97dc-de5d0c14d758,Dekogon Studios,https://www.fab.com/zh-cn/sellers/Dekogon%20Studios,CC BY-NC-SA 4.0,,
1096,a_Box1,"0.998,0.998,1.000",灰色金属军用箱，带竖向波纹板和加固框架,Gray metal military crate with vertical corrugated panels and reinforced frame,军用箱,Military_box,箱子,Box,,ALIGNED_ANISOTROPIC,0,0,"https://www.fab.com/listings/c3148cbb-4b57-4f09-a749-636bc0fe2da2

https://www.fab.com/listings/82e8f9af-843d-46c4-ae16-c6aee0ed4eaa

https://www.fab.com/listings/f3b2aa27-c8be-4987-b8a2-81adf0fe85a8

https://www.fab.com/listings/b5603e44-e1b0-4346-9c3d-04887aa9f87d",SilverTm,https://www.fab.com/zh-cn/sellers/SilverTm,CC BY-NC-SA 4.0,,
1097,a_Box2,"1.239,1.268,1.012",灰绿色帆布覆盖的木质金属加固板条箱,A gray-green canvas-covered wooden crate with metal reinforcements,军用箱,Military_box,箱子,Box,,ALIGNED_ANISOTROPIC,0,0,"https://www.fab.com/listings/c3148cbb-4b57-4f09-a749-636bc0fe2da2

https://www.fab.com/listings/82e8f9af-843d-46c4-ae16-c6aee0ed4eaa

https://www.fab.com/listings/f3b2aa27-c8be-4987-b8a2-81adf0fe85a8

https://www.fab.com/listings/b5603e44-e1b0-4346-9c3d-04887aa9f87d",SilverTm,https://www.fab.com/zh-cn/sellers/SilverTm,CC BY-NC-SA 4.0,,
1186,a_SM_Ammo_Box_Black_Wooden_01a,"1.049,0.467,0.414",深色做旧木质军用弹药箱，带金属提手和搭扣,Dark weathered wooden military ammunition crate with metal handles and latches,军用箱,Military_box,箱子,Box,,ALIGNED_ANISOTROPIC,0,0,https://www.fab.com/listings/77e58b77-87a8-4c97-97dc-de5d0c14d758,Dekogon Studios,https://www.fab.com/zh-cn/sellers/Dekogon%20Studios,CC BY-NC-SA 4.0,,
1187,a_SM_Ammo_Box_Green_Wooden_01a,"1.049,0.487,0.419",深绿色做旧军用弹药箱带金属提手和搭扣,Weathered dark green military ammunition box with metal handles and latch,军用箱,Military_box,箱子,Box,,ALIGNED_ANISOTROPIC,0,0,https://www.fab.com/listings/77e58b77-87a8-4c97-97dc-de5d0c14d758,Dekogon Studios,https://www.fab.com/zh-cn/sellers/Dekogon%20Studios,CC BY-NC-SA 4.0,,
1277,a_SM_Box_Wooden_01a,"1.119,0.511,0.210",带金属扣和加固角的风化木质军用箱,Weathered wooden military crate with metal clasps and reinforced corners,军用箱,Military_box,箱子,Box,,ALIGNED_ANISOTROPIC,0,0,https://www.fab.com/listings/77e58b77-87a8-4c97-97dc-de5d0c14d758,Dekogon Studios,https://www.fab.com/zh-cn/sellers/Dekogon%20Studios,CC BY-NC-SA 4.0,,
1481,a_SM_Ground_Props_Trash_01u,"0.420,0.375,0.157","深棕色做旧木质军用箱,带金属扣件和把手",Weathered dark brown wooden military crate with metal clasps and handles,军用箱,Military_box,箱子,Box,,ALIGNED_ANISOTROPIC,0,0,https://www.fab.com/listings/77e58b77-87a8-4c97-97dc-de5d0c14d758,Dekogon Studios,https://www.fab.com/zh-cn/sellers/Dekogon%20Studios,CC BY-NC-SA 4.0,,
1549,a_SM_machine_gun_ammo_box_closed,"0.281,0.120,0.149",橄榄绿色金属弹药箱，带翻盖和侧把手,Olive green metal ammunition box with hinged lid and side handle,军用箱,Military_box,箱子,Box,,ALIGNED_ANISOTROPIC,0,0,https://www.fab.com/listings/0c106ab4-e1cd-40c2-8731-b7940e52b4b6,EmranArts,https://www.fab.com/zh-cn/sellers/Emran%20Arts,CC BY-NC-SA 4.0,,
1550,a_SM_machine_gun_ammo_box_opened,"0.281,0.227,0.143",打开的橄榄绿色军用弹药箱装满步枪子弹,Open olive green military ammo box filled with rifle cartridges,军用箱,Military_box,箱子,Box,,ALIGNED_ANISOTROPIC,0,0,https://www.fab.com/listings/0c106ab4-e1cd-40c2-8731-b7940e52b4b6,EmranArts,https://www.fab.com/zh-cn/sellers/Emran%20Arts,CC BY-NC-SA 4.0,,
285,1_AntitankObstacles,"2.444,2.198,1.864",六角交叉铁梁构成的锈蚀金属反坦克路障,Weathered metal anti-tank hedgehog obstacle with six intersecting beams,军用障碍物,Military_obstacle,军用障碍物,Military_obstacle,,ALIGNED_ANISOTROPIC,0,0,https://www.fab.com/zh-cn/listings/e9415a4b-3cf7-4336-92a6-f08a25d784c2,SilverTm,https://www.fab.com/zh-cn/sellers/SilverTm,CC BY-NC-SA 4.0,,
286,1_Barbwire01,"2.060,0.663,0.676",灰色螺旋金属框架带刺铁丝网障碍物,Gray barbed wire coil obstacle with spiral metal framework,军用障碍物,Military_obstacle,军用障碍物,Military_obstacle,,RADIAL,0,0,https://www.fab.com/zh-cn/listings/e9415a4b-3cf7-4336-92a6-f08a25d784c2,SilverTm,https://www.fab.com/zh-cn/sellers/SilverTm,CC BY-NC-SA 4.0,,
289,1_Sandbag03,"3.277,0.571,0.924",之字形堆叠的米黄色沙袋防御墙,Stacked beige sandbag barricade wall in zigzag formation,军用障碍物,Military_obstacle,军用障碍物,Military_obstacle,,ALIGNED_ANISOTROPIC,0,0,https://www.fab.com/zh-cn/listings/e9415a4b-3cf7-4336-92a6-f08a25d784c2,SilverTm,https://www.fab.com/zh-cn/sellers/SilverTm,CC BY-NC-SA 4.0,,
1446,a_SM_Fence_Helmet_01a,"1.758,0.900,0.832",带铁丝网的风化木质X型框架障碍物,Weathered wooden X-frame obstacle with barbed wire attachments,军用障碍物,Military_obstacle,军用障碍物,Military_obstacle,,SORTED_ANISOTROPIC,0,0,https://www.fab.com/listings/77e58b77-87a8-4c97-97dc-de5d0c14d758,Dekogon Studios,https://www.fab.com/zh-cn/sellers/Dekogon%20Studios,CC BY-NC-SA 4.0,,
825,44_sk49_CoffeeMaker01,"0.257,0.443,0.547",带深色手柄和顶钮的灰色八角摩卡咖啡壶,A gray octagonal moka pot with dark handle and lid knob,咖啡壶,Coffee_pot,咖啡壶,Coffee_pot,,RADIAL,0,0,https://sketchfab.com/3d-models/espresso-coffee-maker-679a10f369094f2d8bf2016be94f43b2,kuroru,https://sketchfab.com/kuroru0,CC BY-NC-SA 4.0,,
173,0_SM_Deco019,"0.170,0.405,0.300",带深色触控面板和不锈钢杯托的鼠尾草绿咖啡机,A sage green coffee machine with dark touch panel and stainless steel cup holder,咖啡机,Coffee_machine,咖啡机,Coffee_machine,,ISOTROPIC,0,0,商品下架，但作者已同意,CityColor（黄烨）,CityColor（黄烨）,CC BY-NC-SA 4.0,,
741,40_CoffeeMaker,"0.217,0.234,0.312",带玻璃壶和灰色冲泡篮的白色咖啡机,A white coffee maker with glass carafe and gray brew basket,咖啡机,Coffee_machine,咖啡机,Coffee_machine,,ISOTROPIC,0,0,https://www.fab.com/zh-cn/listings/38998304-cdb1-4583-b12d-fe3ef77e9157,Dekogon Studios,https://www.fab.com/zh-cn/sellers/Dekogon%20Studios,CC BY-NC-SA 4.0,,
924,49_SM_CoffeeHeater_01a,"0.609,0.522,0.497",灰色工业双头咖啡机带控制面板,Industrial gray coffee machine with dual brewing stations and control panel,咖啡机,Coffee_machine,咖啡机,Coffee_machine,,ISOTROPIC,0,1,https://www.fab.com/listings/0c7b600e-016f-4ca5-b936-a4af4fbd5aef,Dekogon Studios,https://www.fab.com/zh-cn/sellers/Dekogon%20Studios,CC BY-NC-SA 4.0,,
925,49_SM_CoffeeMachine_04a,"0.865,0.622,0.652",灰色商用咖啡机配双黑色冲煮篮和白色保温壶,A gray commercial coffee machine with dual black brew baskets and white thermal carafes,咖啡机,Coffee_machine,咖啡机,Coffee_machine,,ISOTROPIC,0,1,https://www.fab.com/listings/0c7b600e-016f-4ca5-b936-a4af4fbd5aef,Dekogon Studios,https://www.fab.com/zh-cn/sellers/Dekogon%20Studios,CC BY-NC-SA 4.0,,
926,49_SM_CoffeMachine_01a,"0.709,0.440,0.970","深灰色商用咖啡自动售货机,带棕色咖啡杯图案和选择按钮",A dark gray commercial coffee vending machine with brown coffee cup graphics and selection buttons,咖啡机,Coffee_machine,咖啡机,Coffee_machine,,ISOTROPIC,0,0,https://www.fab.com/listings/0c7b600e-016f-4ca5-b936-a4af4fbd5aef,Dekogon Studios,https://www.fab.com/zh-cn/sellers/Dekogon%20Studios,CC BY-NC-SA 4.0,,
1010,7_SM_Microscope_Platform,"0.139,0.171,0.254",白色和灰色小型咖啡机，带垂直冲泡腔和圆柱形杯托,A white and gray compact coffee machine with vertical brewing chamber and cylindrical cup holder,咖啡机,Coffee_machine,咖啡机,Coffee_machine,,ISOTROPIC,0,1,https://www.fab.com/zh-cn/listings/d4cfc535-bc2c-4a5e-aa0d-d3649f1e5f4f,EmranArts,https://www.fab.com/zh-cn/sellers/Emran%20Arts,CC BY-NC-SA 4.0,,
1026,8_SM_coffee_machine_machine,"0.622,0.420,0.380","灰色双头商用咖啡机,带控制按钮面板",A gray commercial espresso machine with dual group heads and control buttons,咖啡机,Coffee_machine,咖啡机,Coffee_machine,,ISOTROPIC,0,0,https://www.fab.com/zh-cn/listings/ea1058b0-0a6e-4bff-a206-583c8f18b89f,EmranArts,https://www.fab.com/zh-cn/sellers/Emran%20Arts,CC BY-NC-SA 4.0,,
1125,a_CoffeeMachine,"0.677,0.708,1.996","深灰色立式自动咖啡售卖机,带精品咖啡广告面板和选择按钮",Tall dark gray vending-style coffee machine with premium coffee branding and selection buttons,咖啡机,Coffee_machine,咖啡机,Coffee_machine,,ISOTROPIC,0,0,"https://www.fab.com/listings/c3148cbb-4b57-4f09-a749-636bc0fe2da2

https://www.fab.com/listings/82e8f9af-843d-46c4-ae16-c6aee0ed4eaa

https://www.fab.com/listings/f3b2aa27-c8be-4987-b8a2-81adf0fe85a8

https://www.fab.com/listings/b5603e44-e1b0-4346-9c3d-04887aa9f87d",SilverTm,https://www.fab.com/zh-cn/sellers/SilverTm,CC BY-NC-SA 4.0,,
35,0_chinese_tea_table_2k_packed,"0.841,0.836,0.499","深色方形木质茶几,带雕花围板和粗壮桌腿",Square dark wood coffee table with decorative carved apron and sturdy legs,咖啡桌,Coffee_table,桌子,Table,,ALIGNED_ANISOTROPIC,0,0,https://polyhaven.com/a/chinese_tea_table,Kirill Sannikov,https://polyhaven.com/all?a=Kirill%20Sannikov,CC BY-NC-SA 4.0,,
37,0_Classic_table_v2,"2.567,1.069,0.801",大型椭圆形胡桃木茶几，带雕花双柱底座,A large oval walnut coffee table with ornate carved double pedestal base,咖啡桌,Coffee_table,桌子,Table,,ALIGNED_ANISOTROPIC,0,0,https://www.fab.com/zh-cn/listings/f7a6e726-d9ab-4fad-843f-d28b622b78d0,NextLevel3D,https://www.fab.com/zh-cn/sellers/Next%20Level%203D,CC BY-NC-SA 4.0,,
39,0_coffee_table_01_2k_packed,"1.576,0.758,1.718",带有储物抽屉的蓝绿色咖啡桌,Teal coffee table with storage drawer,咖啡桌,Coffee_table,桌子,Table,,ALIGNED_ANISOTROPIC,0,0,https://polyhaven.com/a/CoffeeTable_01,Fernando Quinn,https://polyhaven.com/all?a=Fernando%20Quinn,CC BY-NC-SA 4.0,,
100,0_painted_wooden_nightstand_2k_packed,"0.639,0.662,1.264",复古做旧木质台面搭配灰蓝色漆面单抽屉边桌,A rustic end table with weathered wood top and gray-blue painted base with single drawer,咖啡桌,Coffee_table,桌子,Table,,ALIGNED_ANISOTROPIC,0,0,https://polyhaven.com/a/painted_wooden_nightstand,Kirill Sannikov,https://polyhaven.com/all?a=Kirill%20Sannikov,CC BY-NC-SA 4.0,abort,
110,0_Round_table,"1.307,1.308,0.769",带雕花底座和弧形十字脚的圆形红木咖啡桌,Round mahogany coffee table with carved pedestal base and curved cross feet,咖啡桌,Coffee_table,桌子,Table,,RADIAL,0,0,https://www.fab.com/zh-cn/listings/f7a6e726-d9ab-4fad-843f-d28b622b78d0,NextLevel3D,https://www.fab.com/zh-cn/sellers/Next%20Level%203D,CC BY-NC-SA 4.0,,
111,0_round_wooden_table_01_2k_packed,"1.399,1.399,1.005","深棕色圆形木质咖啡桌,带车削中柱和三脚支撑底座",A round dark brown wooden coffee table with turned pedestal base and tripod legs,咖啡桌,Coffee_table,桌子,Table,,RADIAL,0,0,https://polyhaven.com/a/round_wooden_table_01,Ulan Cabanilla,https://polyhaven.com/all?a=Ulan%20Cabanilla,CC BY-NC-SA 4.0,,
117,0_side_table_01_2k_packed,"0.550,0.450,0.551",浅橡木色双层开放式置物咖啡桌,A light oak wood coffee table with two open storage shelves,咖啡桌,Coffee_table,桌子,Table,,ALIGNED_ANISOTROPIC,1,0,https://polyhaven.com/a/side_table_01,James Ray Cock,https://polyhaven.com/all?a=James%20Ray%20Cock,CC BY-NC-SA 4.0,,
204,0_SM_Kitchen_table,"1.342,1.342,0.722",深灰色圆形咖啡桌，带交叉竖板底座,A dark gray round coffee table with intersecting vertical panel base,咖啡桌,Coffee_table,桌子,Table,,RADIAL,0,0,ue fab:https://www.fab.com/zh-cn/listings/c06d2cad-0d69-4b0d-8f54-b670f7ab2b6c,NextLevel3D,https://www.fab.com/zh-cn/sellers/Next%20Level%203D,CC BY-NC-SA 4.0,,
245,0_SM_Table_1,"1.999,0.999,0.736",简约灰色长方形咖啡桌，带锥形桌腿,A minimalist gray rectangular coffee table with tapered legs,咖啡桌,Coffee_table,桌子,Table,,ALIGNED_ANISOTROPIC,0,0,https://www.fab.com/listings/ce90085d-3f46-456e-b436-f1fa48081be4,NextLevel3D,https://www.fab.com/zh-cn/sellers/Next%20Level%203D,CC BY-NC-SA 4.0,,
435,17_SM_Coffee_table_1,"0.510,0.510,0.480",米色圆盘桌面搭配亮绿色锥形底座的边几,A beige round tray table with bright green conical base,咖啡桌,Coffee_table,桌子,Table,,RADIAL,0,0,https://www.fab.com/zh-cn/listings/96c7bdc7-7b70-4493-8996-afe8930591c1,NextLevel3D,https://www.fab.com/zh-cn/sellers/Next%20Level%203D,CC BY-NC-SA 4.0,,
487,19_SM_Coffee_Table,"0.749,0.749,0.447",圆形木质桌面配三脚金属支架茶几,Round wooden coffee table with tripod metal base,咖啡桌,Coffee_table,桌子,Table,,RADIAL,0,0,https://www.fab.com/zh-cn/listings/1a72172a-5c59-47c4-b917-5be934128101,NextLevel3D,https://www.fab.com/zh-cn/sellers/Next%20Level%203D,CC BY-NC-SA 4.0,,
511,20_SM_Coffee_table,"1.140,0.800,0.411",两张重叠的椭圆形咖啡桌，浅灰色桌面配原木色桌腿,Two overlapping oval coffee tables with light gray tops and natural wood legs,咖啡桌,Coffee_table,桌子,Table,,RADIAL,0,0,https://www.fab.com/zh-cn/listings/5315e021-834d-48b0-b916-b4063cb25fc0,NextLevel3D,https://www.fab.com/zh-cn/sellers/Next%20Level%203D,CC BY-NC-SA 4.0,,
1391,a_SM_CoffeeTable_01a,"1.500,0.800,0.405",带黑色金属框架和下层搁板的长方形木质咖啡桌,A rectangular wooden coffee table with black metal frame and lower shelf,咖啡桌,Coffee_table,桌子,Table,,ALIGNED_ANISOTROPIC,1,0,Imaginarium Group,Imaginarium Group,https://ydove0324.github.io/Imaginarium/,CC BY-NC-SA 4.0,,
1392,a_SM_CoffeeTable_01b,"0.820,0.800,0.405","双层木质咖啡桌,深色下层搁板配浅棕色框架",A two-tier wooden coffee table with dark lower shelf and light brown frame,咖啡桌,Coffee_table,桌子,Table,,ALIGNED_ANISOTROPIC,1,0,Imaginarium Group,Imaginarium Group,https://ydove0324.github.io/Imaginarium/,CC BY-NC-SA 4.0,,
1959,d_1000001621126,"0.633,0.633,0.580",烟灰色玻璃台面配黑色发夹腿圆形茶几,A round coffee table with smoked glass top and black hairpin legs,咖啡桌,Coffee_table,桌子,Table,,RADIAL,0,0,Imaginarium Group,Imaginarium Group,https://ydove0324.github.io/Imaginarium/,CC BY-NC-SA 4.0,,
2016,d_1000009603767,"1.201,1.201,0.812",深色金属圆形小酒馆桌，弧形底座配装饰脚,Round dark metal bistro table with curved pedestal base and decorative feet,咖啡桌,Coffee_table,桌子,Table,,RADIAL,0,0,Imaginarium Group,Imaginarium Group,https://ydove0324.github.io/Imaginarium/,CC BY-NC-SA 4.0,,
114,0_scandinavian_masonry_heater_2k_packed,"1.168,1.335,2.360",带横向凹槽和小门的高大圆柱形蓝灰色金属炉,A tall cylindrical blue-grey metal stove with horizontal ridges and small door opening,烤炉,Oven,烤炉,Oven,,RADIAL,0,0,https://polyhaven.com/a/scandinavian_masonry_heater,Kuutti Siitonen,https://polyhaven.com/all?a=Kuutti%20Siitonen,CC BY-NC-SA 4.0,,
830,44_sk53_Toaster01,"0.356,0.185,0.233",白色Tefal双槽烤面包机配黑色控制旋钮,A white Tefal two-slice toaster with black control dials,烤面包机,Toaster,烤面包机,Toaster,,ISOTROPIC,0,0,https://sketchfab.com/3d-models/toaster-0dd620043178479db6752ab103b1e04e,Artem P,https://sketchfab.com/temp0.crazy,CC BY-NC-SA 4.0,,
31,0_chinese_armchair_2k_packed,"0.848,0.789,1.587",深棕色木质明式官帽椅，带弧形搭脑和雕花靠背板,A dark brown wooden Chinese official's chair with curved yoke-back and carved splat,靠背椅,Backrest_chair,凳椅沙发,Stool_chair_or_sofa,,ISOTROPIC,0,0,https://polyhaven.com/a/chinese_armchair,Kirill Sannikov,https://polyhaven.com/all?a=Kirill%20Sannikov,CC BY-NC-SA 4.0,,
98,0_painted_wooden_chair_01_2k_packed,"1.195,0.617,1.182",白色实木餐椅，带竖条板式靠背和木板座面,A white wooden chair with vertical slat backrest and plank seat,靠背椅,Backrest_chair,凳椅沙发,Stool_chair_or_sofa,,ISOTROPIC,0,0,https://polyhaven.com/a/painted_wooden_chair_01,Kuutti Siitonen,https://polyhaven.com/all?a=Kuutti%20Siitonen,CC BY-NC-SA 4.0,,
99,0_painted_wooden_chair_02_2k_packed,"0.432,0.540,0.956",做旧灰蓝色木质梯背椅，带风化质感,A weathered gray-blue wooden chair with ladder-back design and distressed finish,靠背椅,Backrest_chair,凳椅沙发,Stool_chair_or_sofa,,ISOTROPIC,0,0,https://polyhaven.com/a/painted_wooden_chair_02,Kirill Sannikov,https://polyhaven.com/all?a=Kirill%20Sannikov,CC BY-NC-SA 4.0,,
105,0_plastic_monobloc_chair_01_2k_packed,"0.642,0.628,0.880",白色塑料条纹靠背扶手椅,A white plastic garden chair with slatted back and armrests,靠背椅,Backrest_chair,凳椅沙发,Stool_chair_or_sofa,,ISOTROPIC,0,0,https://polyhaven.com/a/plastic_monobloc_chair_01,Kuutti Siitonen,https://polyhaven.com/all?a=Kuutti%20Siitonen,CC BY-NC-SA 4.0,,
109,0_rockingchair_01_2k_packed,"0.708,0.833,0.995","深棕色木质摇椅,带有栏杆式靠背和扶手",A dark brown wooden rocking chair with spindle back and armrests,靠背椅,Backrest_chair,凳椅沙发,Stool_chair_or_sofa,,ISOTROPIC,0,0,https://polyhaven.com/a/Rockingchair_01,Jorge Camacho,https://polyhaven.com/all?a=Jorge%20Camacho,CC BY-NC-SA 4.0,,
115,0_school_chair_01_2k_packed,"0.566,0.675,1.006",深蓝色塑料通风槽学生椅配金属腿,A navy blue plastic school chair with ventilation slots and metal legs,靠背椅,Backrest_chair,凳椅沙发,Stool_chair_or_sofa,,ISOTROPIC,0,0,https://polyhaven.com/a/SchoolChair_01,Ethan Place,https://polyhaven.com/all?a=Ethan%20Place,CC BY-NC-SA 4.0,,
154,0_SM_Chair_1,"0.647,0.637,0.851",现代白色软包椅配深色木腿和倾斜靠背,A modern white upholstered chair with dark wooden legs and sloped backrest,靠背椅,Backrest_chair,凳椅沙发,Stool_chair_or_sofa,,ISOTROPIC,0,0,https://www.fab.com/listings/ce90085d-3f46-456e-b436-f1fa48081be4,NextLevel3D,https://www.fab.com/zh-cn/sellers/Next%20Level%203D,CC BY-NC-SA 4.0,,
155,0_SM_Chair_2,"0.498,0.614,0.890",浅灰色软包餐椅配深色锥形木腿,A light gray upholstered dining chair with dark wooden tapered legs,靠背椅,Backrest_chair,凳椅沙发,Stool_chair_or_sofa,,ISOTROPIC,0,0,https://www.fab.com/listings/ce90085d-3f46-456e-b436-f1fa48081be4,NextLevel3D,https://www.fab.com/zh-cn/sellers/Next%20Level%203D,CC BY-NC-SA 4.0,,
156,0_SM_Chair_Sec001,"0.712,0.693,1.104",白色雕花框架配深蓝绿色软垫的扶手椅,An ornate white-framed armchair with deep teal blue upholstery,靠背椅,Backrest_chair,凳椅沙发,Stool_chair_or_sofa,,ISOTROPIC,0,0,商品下架，但作者已同意,CityColor（黄烨）,CityColor（黄烨）,CC BY-NC-SA 4.0,,
221,0_SM_Old_Chair,"0.484,0.490,0.951","深棕色木质餐椅,带X型雕花靠背和车削椅腿",Dark brown wooden chair with carved X-pattern backrest and turned legs,靠背椅,Backrest_chair,凳椅沙发,Stool_chair_or_sofa,,ISOTROPIC,0,0,https://www.fab.com/zh-cn/listings/baece383-bc75-4de8-971d-25110a169a36,NextLevel3D,https://www.fab.com/zh-cn/sellers/Next%20Level%203D,CC BY-NC-SA 4.0,,
349,12_SM_Chair_2,"0.474,0.467,0.840",棕色木质椅配弯曲扶手和花卉图案软垫座椅,Brown wooden chair with curved bentwood armrests and floral upholstered seat,靠背椅,Backrest_chair,凳椅沙发,Stool_chair_or_sofa,,ISOTROPIC,0,0,https://www.fab.com/zh-cn/listings/a240ec0c-aabc-4c7e-917a-41949b0c2578,EmranArts,https://www.fab.com/zh-cn/sellers/Emran%20Arts,CC BY-NC-SA 4.0,,
405,15_SM_Chair_2,"0.556,0.599,0.921",灰色绒面菱格纹弓形底座办公椅,A gray quilted office chair with cantilever chrome frame,靠背椅,Backrest_chair,凳椅沙发,Stool_chair_or_sofa,,ISOTROPIC,0,0,https://www.fab.com/zh-cn/listings/7d0ba3e2-b243-4ec9-bbe3-a3059dc3bc37,NextLevel3D,https://www.fab.com/zh-cn/sellers/Next%20Level%203D,CC BY-NC-SA 4.0,,
510,20_SM_Chair,"0.482,0.580,0.832",浅灰色软垫高靠背椅配木质腿,A light gray upholstered chair with wooden legs and high backrest,靠背椅,Backrest_chair,凳椅沙发,Stool_chair_or_sofa,,ISOTROPIC,0,0,https://www.fab.com/zh-cn/listings/5315e021-834d-48b0-b916-b4063cb25fc0,NextLevel3D,https://www.fab.com/zh-cn/sellers/Next%20Level%203D,CC BY-NC-SA 4.0,,
677,3_Chair1,"0.671,0.665,1.050",灰色金属框架可堆叠织物座椅,A gray metal-frame stackable chair with textured fabric seat and backrest,靠背椅,Backrest_chair,凳椅沙发,Stool_chair_or_sofa,,ISOTROPIC,0,0,https://www.fab.com/zh-cn/listings/6658d619-fe4b-462e-80cb-89a4c052baac,SilverTm,https://www.fab.com/zh-cn/sellers/SilverTm,CC BY-NC-SA 4.0,,
749,43_dentistchair01,"0.691,0.718,1.206",灰色布艺高靠背办公椅带白色轮脚,Gray fabric office chair with high backrest and white wheeled base,靠背椅,Backrest_chair,凳椅沙发,Stool_chair_or_sofa,,ISOTROPIC,0,0,https://www.fab.com/zh-cn/listings/7d0ba3e2-b243-4ec9-bbe3-a3059dc3bc37,NextLevel3D,https://www.fab.com/zh-cn/sellers/Next%20Level%203D,CC BY-NC-SA 4.0,,
760,43_outsidechair01,"0.423,0.564,0.859",带横向木条板和灰色金属框架的折叠椅,A folding chair with horizontal wooden slats and gray metal frame,靠背椅,Backrest_chair,凳椅沙发,Stool_chair_or_sofa,,ISOTROPIC,0,0,https://polyhaven.com/a/outdoor_table_chair_set_01,James Ray Cock,https://polyhaven.com/all?a=James%20Ray%20Cock,CC BY-NC-SA 4.0,,
1188,a_SM_Armchair,"0.755,0.880,0.807",灰色布艺坐垫和靠背的中世纪现代风格木质扶手椅,Mid-century modern wooden armchair with gray upholstered seat and backrest,靠背椅,Backrest_chair,凳椅沙发,Stool_chair_or_sofa,,ISOTROPIC,0,0,https://www.fab.com/listings/cb492691-2363-4ff9-a16b-87d6b3fb081e,NextLevel3D,https://www.fab.com/zh-cn/sellers/Next%20Level%203D,CC BY-NC-SA 4.0,,
1190,a_SM_Armchair_02,"0.808,0.845,0.891","深灰色布艺休闲椅,配木质腿和弧形扶手",A charcoal gray upholstered lounge chair with wooden legs and curved armrests,靠背椅,Backrest_chair,凳椅沙发,Stool_chair_or_sofa,,ISOTROPIC,0,0,Imaginarium Group,Imaginarium Group,https://ydove0324.github.io/Imaginarium/,CC BY-NC-SA 4.0,,
1382,a_SM_Chair_Table_Wooden_01a,"0.547,0.532,1.192",深棕色木质竖条纹靠背椅,Dark brown wooden chair with vertical slat backrest,靠背椅,Backrest_chair,凳椅沙发,Stool_chair_or_sofa,,ISOTROPIC,0,0,https://www.fab.com/listings/77e58b77-87a8-4c97-97dc-de5d0c14d758,Dekogon Studios,https://www.fab.com/zh-cn/sellers/Dekogon%20Studios,CC BY-NC-SA 4.0,,
1384,a_SM_ChairVintage,"0.657,0.613,1.390","深棕色维多利亚风格椅子,带弧形腿和铆钉装饰软垫",A dark brown Victorian-style chair with curved legs and studded upholstery,靠背椅,Backrest_chair,凳椅沙发,Stool_chair_or_sofa,,ISOTROPIC,0,0,Imaginarium Group,Imaginarium Group,https://ydove0324.github.io/Imaginarium/,CC BY-NC-SA 4.0,,
1424,a_SM_desk_chair,"0.509,0.536,1.066",深棕色木质竖条纹靠背椅,A dark brown wooden chair with vertical slat backrest,靠背椅,Backrest_chair,凳椅沙发,Stool_chair_or_sofa,,ISOTROPIC,0,0,https://www.fab.com/listings/0c106ab4-e1cd-40c2-8731-b7940e52b4b6,EmranArts,https://www.fab.com/zh-cn/sellers/Emran%20Arts,CC BY-NC-SA 4.0,,
1520,a_SM_KitchenChair_01a,"0.557,0.617,0.931",极简风格黑色软垫椅配金属雪橇腿,A minimalist black upholstered chair with metal sled base legs,靠背椅,Backrest_chair,凳椅沙发,Stool_chair_or_sofa,,ISOTROPIC,0,0,Imaginarium Group,Imaginarium Group,https://ydove0324.github.io/Imaginarium/,CC BY-NC-SA 4.0,,
1548,a_SM_LoungeChair_01a,"0.627,0.513,0.881",现代风格扶手椅，木质雪橇式框架搭配灰紫色软垫座椅和靠背,Modern armchair with wooden sled base frame and mauve upholstered seat and backrest,靠背椅,Backrest_chair,凳椅沙发,Stool_chair_or_sofa,,ISOTROPIC,0,0,Imaginarium Group,Imaginarium Group,https://ydove0324.github.io/Imaginarium/,CC BY-NC-SA 4.0,,
1862,b_111,"0.662,0.604,0.796",弧形棕色皮革座面配浅色木质扶手椅,A curved brown leather seat with light wood frame and armrests,靠背椅,Backrest_chair,凳椅沙发,Stool_chair_or_sofa,,ISOTROPIC,0,0,3D Future Dataset,3D Future Dataset,https://tianchi.aliyun.com/dataset/98063,CC BY-NC-SA 4.0,,
1865,b_114,"0.410,0.388,0.612",浅灰色软包扇形绗缝靠背餐椅,Light gray upholstered dining chair with tufted fan-shaped backrest,靠背椅,Backrest_chair,凳椅沙发,Stool_chair_or_sofa,,ISOTROPIC,0,0,3D Future Dataset,3D Future Dataset,https://tianchi.aliyun.com/dataset/98063,CC BY-NC-SA 4.0,,
1866,b_115,"0.920,0.836,0.933",带圆形镂空和锥形腿的紫灰色菱格纹靠背椅,A mauve quilted backrest chair with circular cutout and tapered legs,靠背椅,Backrest_chair,凳椅沙发,Stool_chair_or_sofa,,ISOTROPIC,0,0,3D Future Dataset,3D Future Dataset,https://tianchi.aliyun.com/dataset/98063,CC BY-NC-SA 4.0,,
1876,b_22,"0.700,0.535,0.801",黑色布艺弧形靠背椅配木质腿,Modern black upholstered chair with curved backrest and wooden legs,靠背椅,Backrest_chair,凳椅沙发,Stool_chair_or_sofa,,ISOTROPIC,0,0,3D Future Dataset,3D Future Dataset,https://tianchi.aliyun.com/dataset/98063,CC BY-NC-SA 4.0,,
1891,b_37,"0.500,0.495,0.779",黑色模压座椅搭配灰褐色木质斜腿的现代椅子,Modern black molded seat chair with taupe wooden splayed legs,靠背椅,Backrest_chair,凳椅沙发,Stool_chair_or_sofa,,ISOTROPIC,0,0,3D Future Dataset,3D Future Dataset,https://tianchi.aliyun.com/dataset/98063,CC BY-NC-SA 4.0,,
