id,name_en,bbx,caption_cn,caption_en,class_cn,class_en,retrieval_class_cn,retrieval_class_en,picture,scaling_strategy,inner_placement,portfolio_assets,source,author_name,author_link,license,state,alignToWallNormal
1995,d_1000006209046,"0.637,0.390,1.413",复古棕色木质四层梯形书架,A rustic brown wooden ladder-style bookshelf with four tiers,书架,Bookshelf,储物柜架,Storage_locker_rack,,SORTED_ANISOTROPIC,1,0,Imaginarium Group,Imaginarium Group,https://ydove0324.github.io/Imaginarium/,CC BY-NC-SA 4.0,,
33,0_chinese_commode_2k_packed,"4.490,1.170,2.020",深色木质亚洲风格长条桌，三个黄铜拉环抽屉配下层镶板储物,Dark wood Asian-style console table with three decorative brass pull drawers and paneled lower storage,书桌,Desk,桌子,Table,,SORTED_ANISOTROPIC,0,0,https://polyhaven.com/a/chinese_commode,Kirill Sannikov,https://polyhaven.com/all?a=Kirill%20Sannikov,CC BY-NC-SA 4.0,,
36,0_Classic_table_old,"2.567,1.069,0.801",古典椭圆形木质雕花双柱底座书桌,Antique oval wooden desk with ornate carved double pedestal base,书桌,Desk,桌子,Table,,ALIGNED_ANISOTROPIC,0,0,https://www.fab.com/zh-cn/listings/f7a6e726-d9ab-4fad-843f-d28b622b78d0,NextLevel3D,https://www.fab.com/zh-cn/sellers/Next%20Level%203D,CC BY-NC-SA 4.0,,
38,0_coffee_cart_01_2k_packed,"1.301,1.301,0.491",白色大理石圆形桌面配深色交叉金属腿茶几,Round white marble-top coffee table with crossed dark metal legs,书桌,Desk,桌子,Table,,ISOTROPIC,0,1,https://polyhaven.com/a/CoffeeCart_01,Joe Seabuhr,https://polyhaven.com/all?a=Joe%20Seabuhr,CC BY-NC-SA 4.0,,
116,0_school_desk_01_2k_packed,"0.712,0.546,0.883",带浅木色桌面、深灰色储物格和可调节金属腿的学生课桌,"A school desk with light wood top, dark gray storage compartment, and adjustable metal legs",书桌,Desk,桌子,Table,,SORTED_ANISOTROPIC,1,0,https://polyhaven.com/a/SchoolDesk_01,Ethan Place,https://polyhaven.com/all?a=Ethan%20Place,CC BY-NC-SA 4.0,,
180,0_SM_Desk_Fir001,"1.437,0.583,0.999",白色法式描金弯腿书桌，带分层顶部储物架,"White ornate French-style desk with curved legs, gold accents, and tiered top storage",书桌,Desk,桌子,Table,,SORTED_ANISOTROPIC,0,0,商品下架，但作者已同意,CityColor（黄烨）,CityColor（黄烨）,CC BY-NC-SA 4.0,,
219,0_SM_Modern_Table,"1.930,0.909,0.780",配有深灰色金属角形支架的矩形木质书桌,A rectangular wooden desk with angular dark gray metal legs,书桌,Desk,桌子,Table,,ALIGNED_ANISOTROPIC,0,0,https://www.fab.com/zh-cn/listings/baece383-bc75-4de8-971d-25110a169a36,NextLevel3D,https://www.fab.com/zh-cn/sellers/Next%20Level%203D,CC BY-NC-SA 4.0,,
222,0_SM_Old_Table,"1.580,0.890,0.750",深棕色车旋腿复古木质书桌,Dark brown wooden desk with turned legs and rustic finish,书桌,Desk,桌子,Table,,ALIGNED_ANISOTROPIC,0,0,https://www.fab.com/zh-cn/listings/baece383-bc75-4de8-971d-25110a169a36,NextLevel3D,https://www.fab.com/zh-cn/sellers/Next%20Level%203D,CC BY-NC-SA 4.0,,
350,12_SM_Desk,"1.934,0.734,0.710",带有精美雕花装饰和警局文字的木质办公桌,A wooden desk with ornate carved floral panels and C-Police Department text,书桌,Desk,桌子,Table,,ALIGNED_ANISOTROPIC,0,0,https://www.fab.com/zh-cn/listings/a240ec0c-aabc-4c7e-917a-41949b0c2578,EmranArts,https://www.fab.com/zh-cn/sellers/Emran%20Arts,CC BY-NC-SA 4.0,,
568,21_SM_Tanker_Desk_NN_01j,"1.524,0.776,0.734",复古米色双边柜木质台面办公桌,Vintage beige desk with wooden top and dual pedestals with drawers,书桌,Desk,桌子,Table,,SORTED_ANISOTROPIC,0,0,https://www.fab.com/zh-cn/listings/c657df25-2ce6-4a62-a147-58778e3085ac,Dekogon Studios,https://www.fab.com/zh-cn/sellers/Dekogon%20Studios,CC BY-NC-SA 4.0,,
582,22_SM_Moroccan_Table_01a,"0.398,0.345,0.424",摩洛哥风格六角边桌，带有华丽彩绘几何图案和镂空格栅面板,Hexagonal Moroccan-style side table with ornate painted geometric patterns and lattice panels,书桌,Desk,桌子,Table,,SORTED_ANISOTROPIC,0,0,https://www.fab.com/zh-cn/listings/fecd3afb-683c-4eb0-8ef8-4ecb99871452,Dekogon Studios,https://www.fab.com/zh-cn/sellers/Dekogon%20Studios,CC BY-NC-SA 4.0,,
643,24_SM_Table_Check_Bank_01b,"2.500,0.800,1.121",灰色现代办公桌，桌面带整合式理线槽,Gray modern desk with integrated cable management slots on top surface,书桌,Desk,桌子,Table,,ALIGNED_ANISOTROPIC,0,0,https://www.fab.com/zh-cn/listings/6710caaf-1375-4a96-a4b3-a696224f17df,Dekogon Studios,https://www.fab.com/zh-cn/sellers/Dekogon%20Studios,CC BY-NC-SA 4.0,,
970,5_SM_Table_A,"12.113,7.246,0.813",大型椭圆形棕色桌面带周边支撑腿,Large oval brown desk surface with supporting legs along the perimeter,书桌,Desk,桌子,Table,,ALIGNED_ANISOTROPIC,0,0,https://www.fab.com/zh-cn/listings/119b5176-cce4-4965-b5b2-2c159377b44a,EmranArts,https://www.fab.com/zh-cn/sellers/Emran%20Arts,CC BY-NC-SA 4.0,,
1423,a_SM_Desk_01b,"1.446,0.741,0.844",深胡桃木色传统书桌，配有车削腿和五个圆形把手抽屉,A traditional dark walnut writing desk with turned legs and five drawers with round knobs,书桌,Desk,桌子,Table,,SORTED_ANISOTROPIC,0,0,Imaginarium Group,Imaginarium Group,https://ydove0324.github.io/Imaginarium/,CC BY-NC-SA 4.0,,
1909,b_55,"1.291,0.619,1.019",黑色斜腿现代书桌，配有书籍和桌面收纳架,"Black modern desk with angled legs, books, and desk organizer",书桌,Desk,桌子,Table,,ISOTROPIC,0,1,3D Future Dataset,3D Future Dataset,https://tianchi.aliyun.com/dataset/98063,CC BY-NC-SA 4.0,,
1958,d_1000001610925,"1.168,0.520,0.767",深棕色木质玄关桌，配有弯曲的卡布里腿和波浪形裙边，带单个抽屉拉手,A dark brown wooden console table with curved cabriole legs and scalloped apron with single drawer knob,书桌,Desk,桌子,Table,,ALIGNED_ANISOTROPIC,0,0,Imaginarium Group,Imaginarium Group,https://ydove0324.github.io/Imaginarium/,CC BY-NC-SA 4.0,,
284,0_yellow_onion_2k_packed,"0.072,0.069,0.086",带纸质外皮和干茎的圆形褐色洋葱,A round brown onion with papery skin and dried stem,蔬菜,Vegetable,食材,Ingredient,,ISOTROPIC,0,0,https://polyhaven.com/a/yellow_onion,Kuutti Siitonen,https://polyhaven.com/all?a=Kuutti%20Siitonen,CC BY-NC-SA 4.0,,
580,22_SM_Food_Stall_Sacks_NN_01m,"0.583,0.525,0.538",装满浅棕色土豆的粗麻布袋,A burlap sack filled with light brown potatoes,蔬菜,Vegetable,食材,Ingredient,,RADIAL,0,0,https://www.fab.com/zh-cn/listings/fecd3afb-683c-4eb0-8ef8-4ecb99871452,Dekogon Studios,https://www.fab.com/zh-cn/sellers/Dekogon%20Studios,CC BY-NC-SA 4.0,,
810,44_sk35_Tomato01,"0.845,0.820,0.748",带绿色叶状茎和花萼的成熟红色番茄,A large ripe red tomato with green leafy stem and calyx,蔬菜,Vegetable,食材,Ingredient,,ISOTROPIC,0,0,https://sketchfab.com/3d-models/tomato-4489b8ec5bc14761a2ddc05241e580af,Claudiu,https://sketchfab.com/claudiupusuc,CC BY-NC-SA 4.0,,
1521,a_SM_KitchenFruit_Tomato01,"0.071,0.071,0.059",一个带深绿色蒂的圆形红色番茄,A round red tomato with dark green stem,蔬菜,Vegetable,食材,Ingredient,,ISOTROPIC,0,0,Imaginarium Group,Imaginarium Group,https://ydove0324.github.io/Imaginarium/,CC BY-NC-SA 4.0,,
496,19_SM_Mouse,"0.070,0.115,0.036",流线型灰色人体工学无线鼠标,A sleek gray wireless mouse with ergonomic curved design,鼠标,Desktop_mouse,鼠标,Desktop_mouse,,ISOTROPIC,0,0,https://www.fab.com/zh-cn/listings/1a72172a-5c59-47c4-b917-5be934128101,NextLevel3D,https://www.fab.com/zh-cn/sellers/Next%20Level%203D,CC BY-NC-SA 4.0,,
686,3_Mouse,"0.053,0.113,0.029",简约白色无线鼠标，磨砂质感,A minimalist white wireless mouse with smooth matte finish,鼠标,Desktop_mouse,鼠标,Desktop_mouse,,ISOTROPIC,0,0,https://www.fab.com/zh-cn/listings/6658d619-fe4b-462e-80cb-89a4c052baac,SilverTm,https://www.fab.com/zh-cn/sellers/SilverTm,CC BY-NC-SA 4.0,,
744,41_ComputerSet_06,"0.069,0.130,0.033",带粉色滚轮的灰色光滑无线鼠标,A smooth gray wireless mouse with pink scroll wheel accent,鼠标,Mouse,鼠标,Mouse,,ISOTROPIC,0,0,https://www.fab.com/zh-cn/listings/9186bda0-5ff4-4e7e-9037-67cbdea463e8,Dekogon Studios,https://www.fab.com/zh-cn/sellers/Dekogon%20Studios,CC BY-NC-SA 4.0,,
775,44_sk103_Mouse01,"0.062,0.111,0.036",流畅曲线设计的灰色无线鼠标,A sleek gray wireless mouse with smooth curved ergonomic design,鼠标,Mouse,鼠标,Mouse,,ISOTROPIC,0,0,https://sketchfab.com/3d-models/computer-mouse-4a6e2b1cf5d54ed5b97da093ed1e74a4,kubassa,https://sketchfab.com/kubassa,CC BY-NC-SA 4.0,,
776,44_sk104_Mouse02,"0.062,0.116,0.035",灰色游戏鼠标带绿色标志和几何纹理表面,A gray gaming mouse with green logo and textured geometric pattern surface,鼠标,Mouse,鼠标,Mouse,,ISOTROPIC,0,0,https://sketchfab.com/3d-models/pc-mouse-type-r-b782768a5ec1453fb2587bd9d82aaf7e,rubykamen,https://sketchfab.com/rubykamen,CC BY-NC-SA 4.0,,
770,44_sk1_BunkBed01,"2.141,1.528,2.093",粉白双层床带梯子和装饰图案床品,Pink and white bunk bed with ladder and decorative patterned bedding,双层床,Bunk_bed,床,Bed,,SORTED_ANISOTROPIC,0,1,https://sketchfab.com/3d-models/children-bed-690711def6994d419a54a6371dc8dfe8,DailyArt,https://sketchfab.com/D.art,CC BY-NC-SA 4.0,,
820,44_sk44_BunkBed02,"2.119,1.761,2.111",浅木色双层床配竖条板和水蓝色绗缝床品,Light wood bunk bed with vertical slat panels and aqua quilted bedding,双层床,Bunk_bed,床,Bed,,SORTED_ANISOTROPIC,0,0,https://sketchfab.com/3d-models/simple-bunk-bed-3d-model-2cabd354ef2e4293ae817b01a8fdbf10,sparshgupta,https://sketchfab.com/SPARSHGUPTA,CC BY-NC-SA 4.0,,
822,44_sk46_BunkBed03,"2.104,2.017,1.617",浅木色双层床配灰色和青蓝色床品，竖条护栏设计,"Light wood bunk bed with gray and teal bedding, vertical slat railings",双层床,Bunk_bed,床,Bed,,SORTED_ANISOTROPIC,0,0,https://sketchfab.com/3d-models/bunk-bed-0e13482338344239abd8b697def3b20c,AM ARCHITECTURE,https://sketchfab.com/abir_sd,CC BY-NC-SA 4.0,,
823,44_sk47_BunkBed04,"2.378,1.012,1.630",带储物楼梯的浅木色白色现代双层床,Modern bunk bed with integrated staircase storage in light wood and white finish,双层床,Bunk_bed,床,Bed,,SORTED_ANISOTROPIC,0,0,https://sketchfab.com/3d-models/bunk-bed-for-kids-fabric-uv-map-fixed-10838a0bfa0c4ab99e0b20a7236ef6d6,slls666,https://sketchfab.com/slls666,CC BY-NC-SA 4.0,,
1881,b_28,"2.702,2.583,2.233",带楼梯护栏和灰色床品的蓝色双层床,"Blue bunk bed with integrated staircase, safety railings, and gray bedding",双层床,Bunk_bed,床,Bed,,SORTED_ANISOTROPIC,0,1,3D Future Dataset,3D Future Dataset,https://tianchi.aliyun.com/dataset/98063,CC BY-NC-SA 4.0,,
63,0_gothic_bed_01_2k_packed,"0.205,0.085,0.075",深色木质哥特式雕花立柱双人床配白色床品,Dark wooden gothic-style bed with ornate carved posts and white bedding,双人床,Double_bed,床,Bed,,SORTED_ANISOTROPIC,0,0,https://polyhaven.com/a/GothicBed_01,Kirill Sannikov,https://polyhaven.com/all?a=Kirill%20Sannikov,CC BY-NC-SA 4.0,,
142,0_SM_Bed,"2.082,2.185,1.108",现代灰色软包双人床配白色床品和深灰纹理床旗,Modern grey upholstered bed with white bedding and textured charcoal runner,双人床,Double_bed,床,Bed,,SORTED_ANISOTROPIC,0,1,https://www.fab.com/listings/ddfc9aa4-ac6d-49ed-bf3f-67dc5314fd3e,NextLevel3D,https://www.fab.com/zh-cn/sellers/Next%20Level%203D,CC BY-NC-SA 4.0,,
143,0_SM_Bed_2,"2.265,2.238,1.020",现代白色软包床配几何米色图案被罩和灰色装饰枕,Modern white upholstered bed with geometric beige patterned duvet and gray accent pillows,双人床,Double_bed,床,Bed,,SORTED_ANISOTROPIC,0,1,https://www.fab.com/listings/ce90085d-3f46-456e-b436-f1fa48081be4,NextLevel3D,https://www.fab.com/zh-cn/sellers/Next%20Level%203D,CC BY-NC-SA 4.0,,
215,0_SM_Modern_Bed_1,"2.386,2.340,1.141",现代双人床，配软包床头板、米色花纹被罩和灰色装饰枕,"Modern double bed with padded headboard, beige patterned duvet and gray accent pillows",双人床,Double_bed,床,Bed,,SORTED_ANISOTROPIC,0,1,https://www.fab.com/zh-cn/listings/baece383-bc75-4de8-971d-25110a169a36,NextLevel3D,https://www.fab.com/zh-cn/sellers/Next%20Level%203D,CC BY-NC-SA 4.0,,
216,0_SM_Modern_Bed_2,"2.354,2.321,1.129",现代白色软包床配灰色分层床品和流畅曲面床头板,Modern white upholstered bed with gray layered bedding and sleek curved headboard,双人床,Double_bed,床,Bed,,SORTED_ANISOTROPIC,0,1,https://www.fab.com/zh-cn/listings/baece383-bc75-4de8-971d-25110a169a36,NextLevel3D,https://www.fab.com/zh-cn/sellers/Next%20Level%203D,CC BY-NC-SA 4.0,,
430,17_SM_Bed,"1.997,2.324,0.917",现代灰白双色软包床配深灰色毯子和抱枕,Modern gray and beige upholstered bed with dark gray throw and matching pillows,双人床,Double_bed,床,Bed,,SORTED_ANISOTROPIC,0,1,https://www.fab.com/zh-cn/listings/96c7bdc7-7b70-4493-8996-afe8930591c1,NextLevel3D,https://www.fab.com/zh-cn/sellers/Next%20Level%203D,CC BY-NC-SA 4.0,,
462,18_SM_Bed,"2.124,2.324,0.916",灰色软包平台床配格纹毯和装饰抱枕,Gray upholstered platform bed with checkered throw blanket and matching accent pillows,双人床,Double_bed,床,Bed,,SORTED_ANISOTROPIC,0,0,https://www.fab.com/zh-cn/listings/3c4f89ac-742c-426e-985c-b912d6d91baa,NextLevel3D,https://www.fab.com/zh-cn/sellers/Next%20Level%203D,CC BY-NC-SA 4.0,,
718,39_MotelBed_01,"2.201,2.275,1.068",带雕花床头板和浅灰色床品的木质双人床,Wooden bed with carved headboard and light gray bedding,双人床,Double_bed,床,Bed,,SORTED_ANISOTROPIC,0,0,https://www.fab.com/zh-cn/listings/d242e22e-55fb-41d7-8e66-755b071807ad,Dekogon Studios,https://www.fab.com/zh-cn/sellers/Dekogon%20Studios,CC BY-NC-SA 4.0,,
1255,a_SM_bed,"2.041,2.612,1.106",现代深色木质双人床配灰色花卉图案床品和软包床头,Modern dark wood double bed with gray floral patterned bedding and upholstered headboard,双人床,Double_bed,床,Bed,,SORTED_ANISOTROPIC,0,0,Imaginarium Group,Imaginarium Group,https://ydove0324.github.io/Imaginarium/,CC BY-NC-SA 4.0,,
1256,a_SM_Bed__2_,"2.248,2.378,0.988",现代灰色软包双人床，配有分层床品和多个靠枕,A modern gray upholstered double bed with layered bedding and multiple pillows,双人床,Double_bed,床,Bed,,SORTED_ANISOTROPIC,0,1,https://www.fab.com/listings/6c2fd1c6-248f-4d98-b55d-70cc19b298a7,NextLevel3D,https://www.fab.com/zh-cn/sellers/Next%20Level%203D,CC BY-NC-SA 4.0,,
1874,b_20,"2.038,2.200,1.115",米色拉扣软包双人床配英国国旗枕头和蓝色花卉床旗,Beige tufted double bed with Union Jack pillows and blue floral runner,双人床,Double_bed,床,Bed,,SORTED_ANISOTROPIC,0,1,3D Future Dataset,3D Future Dataset,https://tianchi.aliyun.com/dataset/98063,CC BY-NC-SA 4.0,,
1884,b_30,"1.940,2.480,1.072",现代风格双人床，配灰色床品、深棕色床旗和木质床架,"Modern double bed with gray bedding, dark brown runner, and wooden frame",双人床,Double_bed,床,Bed,,SORTED_ANISOTROPIC,0,1,3D Future Dataset,3D Future Dataset,https://tianchi.aliyun.com/dataset/98063,CC BY-NC-SA 4.0,,
1885,b_31,"2.081,2.333,1.078",蓝色软包双人床配灰色床品和靠背,Blue upholstered double bed with gray bedding and headboard,双人床,Double_bed,床,Bed,,SORTED_ANISOTROPIC,0,1,3D Future Dataset,3D Future Dataset,https://tianchi.aliyun.com/dataset/98063,CC BY-NC-SA 4.0,,
1896,b_41,"1.696,2.105,1.003",灰色软包双人床配青蓝色毯子和彩色装饰枕头,Gray upholstered double bed with teal throw blanket and colorful decorative pillows,双人床,Double_bed,床,Bed,,SORTED_ANISOTROPIC,0,1,3D Future Dataset,3D Future Dataset,https://tianchi.aliyun.com/dataset/98063,CC BY-NC-SA 4.0,,
1921,b_7,"1.883,2.162,1.281",灰色软包双人床配深蓝条纹床旗和格纹枕头,Gray upholstered double bed with navy striped runner and patterned pillows,双人床,Double_bed,床,Bed,,SORTED_ANISOTROPIC,0,1,3D Future Dataset,3D Future Dataset,https://tianchi.aliyun.com/dataset/98063,CC BY-NC-SA 4.0,,
1966,d_1000003404997,"1.940,2.150,0.950",现代金属框架双人床配灰色床品和米色枕头,Modern metal frame double bed with gray bedding and beige pillows,双人床,Double_bed,床,Bed,,SORTED_ANISOTROPIC,0,1,Imaginarium Group,Imaginarium Group,https://ydove0324.github.io/Imaginarium/,CC BY-NC-SA 4.0,,
1973,d_1000003505663,"1.580,2.020,0.920",现代浅橡木框架双人床配灰色床品和枕头,A modern platform double bed with light oak wood frame and gray bedding with pillows,双人床,Double_bed,床,Bed,,SORTED_ANISOTROPIC,0,0,Imaginarium Group,Imaginarium Group,https://ydove0324.github.io/Imaginarium/,CC BY-NC-SA 4.0,,
157,0_SM_Coffee_cup_2,"0.081,0.107,0.098",装有黑咖啡和泡沫的深灰色磨砂陶瓷马克杯,A matte dark gray ceramic mug with black coffee and foam,水杯,Water_cup,杯子,Cup,,RADIAL,0,0,ue fab:https://www.fab.com/zh-cn/listings/c06d2cad-0d69-4b0d-8f54-b670f7ab2b6c,NextLevel3D,https://www.fab.com/zh-cn/sellers/Next%20Level%203D,CC BY-NC-SA 4.0,,
495,19_SM_Kitchen_Decor_7,"0.099,0.099,0.181",磨砂半透明玻璃杯，带喇叭口和圈足底座,A frosted translucent glass tumbler with flared rim and footed base,水杯,Water_cup,杯子,Cup,,RADIAL,0,0,https://www.fab.com/zh-cn/listings/1a72172a-5c59-47c4-b917-5be934128101,NextLevel3D,https://www.fab.com/zh-cn/sellers/Next%20Level%203D,CC BY-NC-SA 4.0,,
516,20_SM_Kitchen_Decor_20,"0.163,0.163,0.141",灰色陶瓷碗带竖纹纹理和底座,A gray ceramic bowl with vertical ribbed texture and pedestal base,水杯,Water_cup,杯子,Cup,,RADIAL,0,0,https://www.fab.com/zh-cn/listings/5315e021-834d-48b0-b916-b4063cb25fc0,NextLevel3D,https://www.fab.com/zh-cn/sellers/Next%20Level%203D,CC BY-NC-SA 4.0,,
1025,8_SM_coffee_machine_cup,"0.100,0.081,0.047",灰色哑光陶瓷杯配弧形手柄,A gray ceramic cup with smooth matte finish and curved handle,水杯,Water_cup,杯子,Cup,,RADIAL,0,0,https://www.fab.com/zh-cn/listings/ea1058b0-0a6e-4bff-a206-583c8f18b89f,EmranArts,https://www.fab.com/zh-cn/sellers/Emran%20Arts,CC BY-NC-SA 4.0,,
1051,8_SM_small_props_bar_single_glass_02,"0.040,0.040,0.050",简约深灰色圆柱形磨砂水杯,A simple dark gray cylindrical water cup with matte finish,水杯,Water_cup,杯子,Cup,,RADIAL,0,0,https://www.fab.com/zh-cn/listings/ea1058b0-0a6e-4bff-a206-583c8f18b89f,EmranArts,https://www.fab.com/zh-cn/sellers/Emran%20Arts,CC BY-NC-SA 4.0,,
61,0_garden_hose_wall_mounted_01_2k_packed,"0.258,0.210,0.599",深绿色网纹编织缠绕水管,A coiled dark green braided water hose with mesh pattern,水管,Water_pipe,水管,Water_pipe,,RADIAL,0,0,https://polyhaven.com/a/garden_hose_wall_mounted_01,Kuutti Siitonen,https://polyhaven.com/all?a=Kuutti%20Siitonen,CC BY-NC-SA 4.0,,
54,0_food_apple_01_2k_packed,"0.098,0.096,0.085",带黄橙色晕染和斑点纹理的红苹果,A red apple with yellow-orange blush and speckled skin texture,水果,Fruit,食物,Food,,ISOTROPIC,0,0,https://polyhaven.com/a/food_apple_01,Oliver Harries,https://polyhaven.com/all?a=Oliver%20Harries,CC BY-NC-SA 4.0,,
55,0_food_kiwi_01_2k_packed,"0.090,0.070,0.069",带棕色纤维外壳和粗糙纹理的完整猕猴桃,A whole kiwi with brown fibrous husk and textured surface,水果,Fruit,食物,Food,,ISOTROPIC,0,0,https://polyhaven.com/a/food_kiwi_01,Oliver Harries,https://polyhaven.com/all?a=Oliver%20Harries,CC BY-NC-SA 4.0,,
56,0_food_lime_01_2k_packed,"0.075,0.060,0.061",绿色表皮粗糙的鳄梨,A green avocado with textured pebbled skin,水果,Fruit,食物,Food,,ISOTROPIC,0,0,https://polyhaven.com/a/food_lime_01,Oliver Harries,https://polyhaven.com/all?a=Oliver%20Harries,CC BY-NC-SA 4.0,,
57,0_food_pomegranate_01_2k_packed,"0.126,0.167,0.071",带棕色果蒂的红粉色纹理表皮圆形石榴,A round pomegranate with reddish-pink textured skin and brown stem,水果,Fruit,食物,Food,,ISOTROPIC,0,0,https://polyhaven.com/a/food_pomegranate_01,Oliver Harries,https://polyhaven.com/all?a=Oliver%20Harries,CC BY-NC-SA 4.0,,
78,0_lemon_2k_packed,"2.312,0.813,0.317","大型浅黄色柠檬,表皮纹理粗糙,油腺清晰可见",A large pale yellow lemon with textured peel and visible oil glands,水果,Fruit,食物,Food,,ISOTROPIC,0,0,https://polyhaven.com/a/lemon,Kuutti Siitonen,https://polyhaven.com/all?a=Kuutti%20Siitonen,CC BY-NC-SA 4.0,,
168,0_SM_Deco011_02,"0.064,0.056,0.063","黄绿色外皮的柠檬横切片,展示透明果肉瓣",A cross-section slice of lemon with yellow-green rind and translucent flesh segments,水果,Fruit,食物,Food,,ISOTROPIC,0,0,商品下架，但作者已同意,CityColor（黄烨）,CityColor（黄烨）,CC BY-NC-SA 4.0,,
596,22_SM_Street_Vendor_Cart_NN_01d,"0.285,0.282,0.170",白色碗装深紫色带茎烤甜菜,White bowl filled with dark purple roasted beets with stems,水果,Fruit,食物,Food,,ISOTROPIC,0,0,https://www.fab.com/zh-cn/listings/fecd3afb-683c-4eb0-8ef8-4ecb99871452,Dekogon Studios,https://www.fab.com/zh-cn/sellers/Dekogon%20Studios,CC BY-NC-SA 4.0,,
838,44_sk60_WaterMelon01,"0.339,0.246,0.246",带深色条纹的绿色西瓜,A green watermelon with dark striped pattern,水果,Fruit,食物,Food,,ISOTROPIC,0,0,https://sketchfab.com/3d-models/watermelon-low-poly-0c3c2c12b2b940d090b635663edeba82,SUDIPTO SHAW,https://sketchfab.com/sudiptoshow2002,CC BY-NC-SA 4.0,,
1276,a_SM_Bowl_with_Oranges,"0.254,0.253,0.146",装满新鲜杏子的白色碗,White bowl filled with fresh apricots,水果,Fruit,食物,Food,,ISOTROPIC,0,0,https://www.fab.com/listings/6c2fd1c6-248f-4d98-b55d-70cc19b298a7,NextLevel3D,https://www.fab.com/zh-cn/sellers/Next%20Level%203D,CC BY-NC-SA 4.0,,
1570,a_SM_Orange,"0.082,0.081,0.081",带有中心缝线的圆形橙色桃子,A round orange peach with characteristic center seam,水果,Fruit,食物,Food,,ISOTROPIC,0,0,https://www.fab.com/listings/6c2fd1c6-248f-4d98-b55d-70cc19b298a7,NextLevel3D,https://www.fab.com/zh-cn/sellers/Next%20Level%203D,CC BY-NC-SA 4.0,,
1571,a_SM_Orange_Cutted,"0.080,0.079,0.053",横切的半个橙子，可见果肉和中心,Half of an orange cut horizontally showing flesh and center,水果,Fruit,食物,Food,,ISOTROPIC,0,0,https://www.fab.com/listings/6c2fd1c6-248f-4d98-b55d-70cc19b298a7,NextLevel3D,https://www.fab.com/zh-cn/sellers/Next%20Level%203D,CC BY-NC-SA 4.0,,
107,0_pot_enamel_01_2k_packed,"0.263,0.180,0.178",棕色陶瓷水壶带盖和火焰图案装饰,Brown ceramic kettle with lid and flame pattern decoration,水壶,Kettle,水壶,Kettle,,RADIAL,0,0,https://polyhaven.com/a/pot_enamel_01,Kuutti Siitonen,https://polyhaven.com/all?a=Kuutti%20Siitonen,CC BY-NC-SA 4.0,,
170,0_SM_Deco017_02,"0.231,0.140,0.162",配木质手柄和顶钮的白色极简电水壶带方形底座,A white minimalist electric kettle with wooden handle and lid knob on square base,水壶,Kettle,水壶,Kettle,,RADIAL,0,0,商品下架，但作者已同意,CityColor（黄烨）,CityColor（黄烨）,CC BY-NC-SA 4.0,,
415,16_SM_Kitchen_decor_5,"0.113,0.088,0.155",圆柱形不锈钢带倾倒口水壶,A cylindrical stainless steel pitcher with pouring spout,水壶,Kettle,水壶,Kettle,,RADIAL,0,0,https://www.fab.com/zh-cn/listings/c51c4f10-1a2f-4fc6-9cb2-b849bfa42e2c,NextLevel3D,https://www.fab.com/zh-cn/sellers/Next%20Level%203D,CC BY-NC-SA 4.0,,
515,20_SM_Kitchen_Decor_15,"0.157,0.113,0.170",简约灰色圆柱形水壶，内部开口呈深色,A simple gray cylindrical kettle with dark interior opening,水壶,Kettle,水壶,Kettle,,RADIAL,0,0,https://www.fab.com/zh-cn/listings/5315e021-834d-48b0-b916-b4063cb25fc0,NextLevel3D,https://www.fab.com/zh-cn/sellers/Next%20Level%203D,CC BY-NC-SA 4.0,,
517,20_SM_Kitchen_Decor_3,"0.198,0.169,0.227","光滑的白色陶瓷水壶,圆润壶身带弧形手柄",A smooth white ceramic pitcher with rounded body and curved handle,水壶,Kettle,水壶,Kettle,,RADIAL,0,0,https://www.fab.com/zh-cn/listings/5315e021-834d-48b0-b916-b4063cb25fc0,NextLevel3D,https://www.fab.com/zh-cn/sellers/Next%20Level%203D,CC BY-NC-SA 4.0,,
1657,a_SM_rest_area_kettle,"0.200,0.170,0.189",深灰色金属水壶，带弧形提手和壶嘴,A dark gray metal kettle with curved handle and spout,水壶,Kettle,水壶,Kettle,,RADIAL,0,0,https://www.fab.com/listings/0c106ab4-e1cd-40c2-8731-b7940e52b4b6,EmranArts,https://www.fab.com/zh-cn/sellers/Emran%20Arts,CC BY-NC-SA 4.0,,
1658,a_SM_rest_area_kettle_compiled,"0.200,0.170,0.189",深灰色纹理水壶，带弧形提手和壶嘴,A dark gray textured kettle with curved handle and spout,水壶,Kettle,水壶,Kettle,,RADIAL,0,0,https://www.fab.com/listings/0c106ab4-e1cd-40c2-8731-b7940e52b4b6,EmranArts,https://www.fab.com/zh-cn/sellers/Emran%20Arts,CC BY-NC-SA 4.0,,
1659,a_SM_rest_area_kettle_door,"0.123,0.123,0.027",深灰色蘑菇形把手圆形水壶盖,Dark gray round kettle lid with mushroom-shaped knob,水壶盖,Kettle_lid,水壶,Kettle,,RADIAL,0,0,https://www.fab.com/listings/0c106ab4-e1cd-40c2-8731-b7940e52b4b6,EmranArts,https://www.fab.com/zh-cn/sellers/Emran%20Arts,CC BY-NC-SA 4.0,,
1086,a_Bench,"2.481,0.710,1.107",蓝色软垫灰色弧形扶手金属框架四人座长椅,Blue upholstered four-seat bench with gray curved armrests and metal frame,四人座长椅,Four_seater_bench,凳椅沙发,Stool_chair_or_sofa,,SORTED_ANISOTROPIC,0,0,"https://www.fab.com/listings/c3148cbb-4b57-4f09-a749-636bc0fe2da2

https://www.fab.com/listings/82e8f9af-843d-46c4-ae16-c6aee0ed4eaa

https://www.fab.com/listings/f3b2aa27-c8be-4987-b8a2-81adf0fe85a8

https://www.fab.com/listings/b5603e44-e1b0-4346-9c3d-04887aa9f87d",SilverTm,https://www.fab.com/zh-cn/sellers/SilverTm,CC BY-NC-SA 4.0,,
489,19_SM_Kitchen_Decor_16,"0.084,0.084,0.283","半透明白色塑料瓶,带横向波纹纹理和圆柱形瓶盖",A translucent white plastic bottle with horizontal ribbed texture and cylindrical cap,塑料瓶,Plastic_bottle,瓶子,Bottle,,RADIAL,0,0,https://www.fab.com/zh-cn/listings/1a72172a-5c59-47c4-b917-5be934128101,NextLevel3D,https://www.fab.com/zh-cn/sellers/Next%20Level%203D,CC BY-NC-SA 4.0,,
