id,name_en,bbx,caption_cn,caption_en,class_cn,class_en,retrieval_class_cn,retrieval_class_en,picture,scaling_strategy,inner_placement,portfolio_assets,source,author_name,author_link,license,state,alignToWallNormal
1444,a_SM_Fan,"0.918,0.950,0.569",黄铜吊扇配五片深色木质扇叶和圆柱形电机外壳,A brass ceiling fan with five dark wooden blades and cylindrical motor housing,吊扇,Ceiling_fan,吊扇,Ceiling_fan,,RADIAL,0,0,Imaginarium Group,Imaginarium Group,https://ydove0324.github.io/Imaginarium/,CC BY-NC-SA 4.0,,
1445,a_SM_FanLamp_01,"1.016,1.055,0.178",深青铜色吊扇，配有细长流线型扇叶和紧凑电机外壳,A dark bronze ceiling fan with sleek elongated blades and compact motor housing,吊扇,Ceiling_fan,吊扇,Ceiling_fan,,RADIAL,0,0,Imaginarium Group,Imaginarium Group,https://ydove0324.github.io/Imaginarium/,CC BY-NC-SA 4.0,,
166,0_SM_Deco008_02,"0.094,0.095,0.087",带木质盖和极简字样的白色陶瓷糖罐,A white ceramic sugar canister with wooden lid and minimalist lettering,调料瓶罐,Seasoning_bottle_or_jar,调料瓶罐,Seasoning_bottle_or_jar,,RADIAL,0,0,商品下架，但作者已同意,CityColor（黄烨）,CityColor（黄烨）,CC BY-NC-SA 4.0,,
1066,8_SM_small_props_table_stuff_03,"0.025,0.025,0.063","灰色陶瓷胡椒研磨瓶,带纹理瓶身和白色陶瓷盖",A gray ceramic pepper mill with textured body and white ceramic cap,调料瓶罐,Seasoning_bottle_or_jar,调料瓶罐,Seasoning_bottle_or_jar,,RADIAL,0,0,https://www.fab.com/zh-cn/listings/ea1058b0-0a6e-4bff-a206-583c8f18b89f,EmranArts,https://www.fab.com/zh-cn/sellers/Emran%20Arts,CC BY-NC-SA 4.0,,
1067,8_SM_small_props_table_stuff_05,"0.030,0.030,0.106",带灰色瓶盖和白色标签的深色玻璃番茄酱瓶,Dark glass ketchup bottle with gray cap and white label,调料瓶罐,Seasoning_bottle_or_jar,调料瓶罐,Seasoning_bottle_or_jar,,RADIAL,0,0,https://www.fab.com/zh-cn/listings/ea1058b0-0a6e-4bff-a206-583c8f18b89f,EmranArts,https://www.fab.com/zh-cn/sellers/Emran%20Arts,CC BY-NC-SA 4.0,,
1504,a_SM_kitchen_Canisters01_C,"0.053,0.053,0.080",灰绿色陶瓷茶叶罐配木盖和树叶图案,Sage green ceramic tea canister with wooden lid and leaf pattern,调料瓶罐,Seasoning_bottle_or_jar,调料瓶罐,Seasoning_bottle_or_jar,,RADIAL,0,0,Imaginarium Group,Imaginarium Group,https://ydove0324.github.io/Imaginarium/,CC BY-NC-SA 4.0,,
1505,a_SM_kitchen_Canisters01_D,"0.053,0.053,0.080",灰色水泥质感调味罐配木盖印有DECK字样,Gray concrete seasoning jar with wooden lid labeled DECK,调料瓶罐,Seasoning_bottle_or_jar,调料瓶罐,Seasoning_bottle_or_jar,,RADIAL,0,0,Imaginarium Group,Imaginarium Group,https://ydove0324.github.io/Imaginarium/,CC BY-NC-SA 4.0,,
1507,a_SM_Kitchen_Decor_10,"0.052,0.052,0.145",带黑色标签和螺纹黑盖的灰色圆柱形瓶子,A gray cylindrical bottle with black label and ridged black cap,调料瓶罐,Seasoning_bottle_or_jar,调料瓶罐,Seasoning_bottle_or_jar,,RADIAL,0,0,https://www.fab.com/listings/cb492691-2363-4ff9-a16b-87d6b3fb081e,NextLevel3D,https://www.fab.com/zh-cn/sellers/Next%20Level%203D,CC BY-NC-SA 4.0,,
1508,a_SM_Kitchen_Decor_11_Black,"0.077,0.077,0.211",黑色磨砂圆柱形胡椒研磨器配木质顶盖,Matte black cylindrical pepper mill with wooden top,调料瓶罐,Seasoning_bottle_or_jar,调料瓶罐,Seasoning_bottle_or_jar,,RADIAL,0,0,https://www.fab.com/listings/cb492691-2363-4ff9-a16b-87d6b3fb081e,NextLevel3D,https://www.fab.com/zh-cn/sellers/Next%20Level%203D,CC BY-NC-SA 4.0,,
1509,a_SM_Kitchen_Decor_11_White,"0.077,0.077,0.211",白色陶瓷调味瓶配木质软木塞,White ceramic seasoning bottle with wooden cork stopper,调料瓶罐,Seasoning_bottle_or_jar,调料瓶罐,Seasoning_bottle_or_jar,,RADIAL,0,0,https://www.fab.com/listings/cb492691-2363-4ff9-a16b-87d6b3fb081e,NextLevel3D,https://www.fab.com/zh-cn/sellers/Next%20Level%203D,CC BY-NC-SA 4.0,,
588,22_SM_Rug_Stacked_01c,"0.571,0.610,0.225",装饰华丽的织锦毯子堆叠，带有精致的佩斯利和花卉图案，色调温暖,Stack of ornate tapestry blankets with intricate paisley and floral patterns in earth tones,叠放的毛巾,Stacked_towel,毛巾,Stacked_towel,,ALIGNED_ANISOTROPIC,0,0,https://www.fab.com/zh-cn/listings/fecd3afb-683c-4eb0-8ef8-4ecb99871452,Dekogon Studios,https://www.fab.com/zh-cn/sellers/Dekogon%20Studios,CC BY-NC-SA 4.0,,
833,44_sk56_FoldedTowel01,"0.340,0.276,0.034",蓝白条纹格子图案棉质毛巾,Blue and white striped cotton towel with checkered pattern,叠放的毛巾,Stacked_towel,毛巾,Stacked_towel,,SORTED_ANISOTROPIC,0,0,https://sketchfab.com/3d-models/folded-towel-c5f9e72edf7d4b5eaa2ec9b95c3b099d,Nicothin,https://sketchfab.com/juhyt80,CC BY-NC-SA 4.0,,
1362,a_SM_CartonGarbage05,"0.975,0.607,0.259",边缘粗糙的棕色破损纸板堆叠,Stack of torn brown cardboard pieces with rough edges,叠放的破纸板片,Stacked_torn_cardboard_piece,纸板,Cardboard,,ALIGNED_ANISOTROPIC,0,0,"https://www.fab.com/listings/c3148cbb-4b57-4f09-a749-636bc0fe2da2

https://www.fab.com/listings/82e8f9af-843d-46c4-ae16-c6aee0ed4eaa

https://www.fab.com/listings/f3b2aa27-c8be-4987-b8a2-81adf0fe85a8

https://www.fab.com/listings/b5603e44-e1b0-4346-9c3d-04887aa9f87d",SilverTm,https://www.fab.com/zh-cn/sellers/SilverTm,CC BY-NC-SA 4.0,,
1363,a_SM_CartonGarbage06,"0.841,0.576,0.211",边缘粗糙的褐色破损纸板堆叠,Stack of torn brown cardboard pieces with rough edges,叠放的破纸板片,Stacked_torn_cardboard_piece,纸板,Cardboard,,ALIGNED_ANISOTROPIC,0,0,"https://www.fab.com/listings/c3148cbb-4b57-4f09-a749-636bc0fe2da2

https://www.fab.com/listings/82e8f9af-843d-46c4-ae16-c6aee0ed4eaa

https://www.fab.com/listings/f3b2aa27-c8be-4987-b8a2-81adf0fe85a8

https://www.fab.com/listings/b5603e44-e1b0-4346-9c3d-04887aa9f87d",SilverTm,https://www.fab.com/zh-cn/sellers/SilverTm,CC BY-NC-SA 4.0,,
1527,a_SM_lights_fluorescent_hanged,"1.500,0.353,0.184",带外露安装件的风化混凝土长条形荧光吊灯,Weathered concrete rectangular fluorescent ceiling fixture with exposed mounting hardware,顶灯,Ceiling_lamp,照明设备,Lighting_equipment,,SORTED_ANISOTROPIC,0,0,https://www.fab.com/listings/0c106ab4-e1cd-40c2-8731-b7940e52b4b6,EmranArts,https://www.fab.com/zh-cn/sellers/Emran%20Arts,CC BY-NC-SA 4.0,,
1528,a_SM_lights_fluorescent_single_01,"0.850,0.071,0.069",灰色长方形双管荧光吸顶灯,Gray rectangular fluorescent ceiling light fixture with dual tubes,顶灯,Ceiling_lamp,照明设备,Lighting_equipment,,SORTED_ANISOTROPIC,0,0,https://www.fab.com/listings/0c106ab4-e1cd-40c2-8731-b7940e52b4b6,EmranArts,https://www.fab.com/zh-cn/sellers/Emran%20Arts,CC BY-NC-SA 4.0,,
1529,a_SM_lights_fluorescent_wall,"1.221,0.223,0.138",带安装支架的老旧灰色荧光灯管灯具,Weathered gray fluorescent tube light fixture with mounting brackets,顶灯,Ceiling_lamp,照明设备,Lighting_equipment,,SORTED_ANISOTROPIC,0,0,https://www.fab.com/listings/0c106ab4-e1cd-40c2-8731-b7940e52b4b6,EmranArts,https://www.fab.com/zh-cn/sellers/Emran%20Arts,CC BY-NC-SA 4.0,,
812,44_sk37_Stapler01,"0.178,0.052,0.056","黑色金属订书机,流线型棱角设计带灰色装饰",A black metal stapler with sleek angular design and gray accents,订书机,Stapler,订书机,Stapler,,SORTED_ANISOTROPIC,0,0,https://sketchfab.com/3d-models/stapler-2b676f5a3c144599b2454e5529f17650,giuliano.giaretta,https://sketchfab.com/giuliano.giaretta,CC BY-NC-SA 4.0,,
848,44_sk70_SlotMachine01,"0.822,0.780,2.000",带有彩色水果图案和黑色金属框架的复古老虎机,A vintage slot machine with colorful fruit symbols and metallic black frame,赌场老虎机,Casino_slot_machine,赌场老虎机,Casino_slot_machine,,ISOTROPIC,0,0,https://sketchfab.com/3d-models/slot-machine-733ce9f72015427692f3dd0e3c353ce1,Balsamic_Vin,https://sketchfab.com/Balsamic_Vin,CC BY-NC-SA 4.0,,
849,44_sk71_SlotMachine02,"0.877,1.125,1.987",灰蓝色老虎机，带可见转轮、彩色按钮和橙色出币槽,"A gray-blue slot machine with visible reels, colorful buttons, and orange coin tray",赌场老虎机,Casino_slot_machine,赌场老虎机,Casino_slot_machine,,ISOTROPIC,0,0,https://sketchfab.com/3d-models/low-poly-slot-machine-d42ef425b3554abf9fc86e39a9b13389,Bar0nline,https://sketchfab.com/bar0nline,CC BY-NC-SA 4.0,,
850,44_sk72_SlotMachine03,"0.791,0.784,1.908",灰色老虎机带蓝色CICADA品牌标识和三个旋转轮,Gray slot machine with blue CICADA branding and three spinning reels,赌场老虎机,Casino_slot_machine,赌场老虎机,Casino_slot_machine,,ISOTROPIC,0,0,https://sketchfab.com/3d-models/slot-machine-3efc01588cd34eae99bc78a64fa0970c,jacknelsonnsb,https://sketchfab.com/jacknelsonnsb,CC BY-NC-SA 4.0,,
788,44_sk14_CasinoTable01,"2.924,1.635,0.915","黑色边框的双骰子赌桌,绿色绒面带白色投注区标记",A black-framed craps table with green felt surface and white betting layout markings,赌桌,Gaming_table,赌桌,Gaming_table,,SORTED_ANISOTROPIC,0,0,Imaginarium Group,Imaginarium Group,https://ydove0324.github.io/Imaginarium/,CC BY-NC-SA 4.0,,
853,44_sk75_CasinoTable02,"2.922,1.634,0.924",带有橙红色毡面和电路板图案的木质轮盘赌桌,A wooden roulette gaming table with salmon-colored felt surface and circuit board pattern,赌桌,Gaming_table,赌桌,Gaming_table,,SORTED_ANISOTROPIC,0,0,Imaginarium Group,Imaginarium Group,https://ydove0324.github.io/Imaginarium/,CC BY-NC-SA 4.0,,
854,44_sk75_CasinoTable03,"2.920,1.630,0.987",带蓝色印花桌面和深色木质围边的椭圆形赌桌,"Oval gaming table with blue printed surface and dark wooden rim

",赌桌,Gaming_table,赌桌,Gaming_table,,SORTED_ANISOTROPIC,0,0,Imaginarium Group,Imaginarium Group,https://ydove0324.github.io/Imaginarium/,CC BY-NC-SA 4.0,,
855,44_sk75_CasinoTable04,"2.920,1.630,1.230",配有蓝色图案桌面和黑色装饰腿的长方形赌桌,Rectangular gaming table with blue patterned surface and black ornate legs,赌桌,Gaming_table,赌桌,Gaming_table,,SORTED_ANISOTROPIC,0,0,Imaginarium Group,Imaginarium Group,https://ydove0324.github.io/Imaginarium/,CC BY-NC-SA 4.0,,
998,7_SM_Chair_02,"0.677,0.660,0.969",灰色可调节旋转椅，带软垫座椅和靠背及轮式底座,A gray adjustable swivel chair with padded seat and backrest on wheeled base,赌桌椅,Casino_chair,凳椅沙发,Stool_chair_or_sofa,,ISOTROPIC,0,0,Imaginarium Group,Imaginarium Group,https://ydove0324.github.io/Imaginarium/,CC BY-NC-SA 4.0,,
1929,b_8,"0.490,0.581,0.985",深色木质雕花靠背条纹布艺坐垫椅,Dark wood carved-back chair with striped upholstered seat,赌桌椅,Casino_chair,凳椅沙发,Stool_chair_or_sofa,,ISOTROPIC,0,0,3D Future Dataset,3D Future Dataset,https://tianchi.aliyun.com/dataset/98063,CC BY-NC-SA 4.0,,
653,25_SM_Electronics_88a,"0.060,0.112,0.519",带长天线和数字键盘的灰色复古砖块式手机,A vintage gray brick-style mobile phone with extended antenna and numeric keypad,对讲机,Walkie_talkie,对讲机,Walkie_talkie,,ISOTROPIC,0,0,https://www.fab.com/zh-cn/listings/d97d9c3a-8bf4-49f9-b99f-8becd8dd12b3,Dekogon Studios,https://www.fab.com/zh-cn/sellers/Dekogon%20Studios,CC BY-NC-SA 4.0,,
19,0_brass_pot_02_2k_packed,"0.367,0.302,0.109",铜色浅底双耳炖锅,A copper-toned shallow stew pot with dual side handles,炖锅,Stew_pot,厨具,Kitchen_utensil,,RADIAL,0,0,https://polyhaven.com/a/brass_pot_02,Rico Cilliers,https://polyhaven.com/all?a=Rico%20Cilliers,CC BY-NC-SA 4.0,,
178,0_SM_Deco025,"0.222,0.182,0.129","奶油色陶瓷炖锅,带凹槽纹理、圆顶盖和双侧手柄","A cream-colored ceramic stew pot with fluted sides, domed lid and side handles",炖锅,Stew_pot,厨具,Kitchen_utensil,,RADIAL,0,0,商品下架，但作者已同意,CityColor（黄烨）,CityColor（黄烨）,CC BY-NC-SA 4.0,,
1517,a_SM_kitchen_Pot_A,"0.344,0.256,0.150",灰色外观黑色内胆带黑色手柄的炖锅,A gray cooking pot with black interior and black handles,炖锅,Stew_pot,厨具,Kitchen_utensil,,RADIAL,0,0,Imaginarium Group,Imaginarium Group,https://ydove0324.github.io/Imaginarium/,CC BY-NC-SA 4.0,,
1631,a_SM_Pot__2_,"0.261,0.220,0.149",带盖和侧把手的灰色圆柱形炖锅,A gray cylindrical stew pot with lid and side handle,炖锅,Stew_pot,厨具,Kitchen_utensil,,RADIAL,0,0,https://www.fab.com/listings/6c2fd1c6-248f-4d98-b55d-70cc19b298a7,NextLevel3D,https://www.fab.com/zh-cn/sellers/Next%20Level%203D,CC BY-NC-SA 4.0,,
1664,a_SM_rest_area_pan_compiled,"0.279,0.279,0.085",带盖和侧把手的灰色圆形炖锅,Gray round stew pot with lid and side handle,炖锅,Stew_pot,厨具,Kitchen_utensil,,RADIAL,0,0,https://www.fab.com/listings/0c106ab4-e1cd-40c2-8731-b7940e52b4b6,EmranArts,https://www.fab.com/zh-cn/sellers/Emran%20Arts,CC BY-NC-SA 4.0,,
1666,a_SM_rest_area_pod,"0.383,0.268,0.133",深灰色金属炖锅带可折叠侧把手,Dark gray metal cooking pot with folding side handle,炖锅,Stew_pot,厨具,Kitchen_utensil,,RADIAL,0,0,https://www.fab.com/listings/0c106ab4-e1cd-40c2-8731-b7940e52b4b6,EmranArts,https://www.fab.com/zh-cn/sellers/Emran%20Arts,CC BY-NC-SA 4.0,,
1667,a_SM_rest_area_pod_compiled,"0.268,0.268,0.159",深灰色金属炖锅带盖和侧把手,Dark gray metal pot with lid and side handles,炖锅,Stew_pot,厨具,Kitchen_utensil,,RADIAL,0,0,https://www.fab.com/listings/0c106ab4-e1cd-40c2-8731-b7940e52b4b6,EmranArts,https://www.fab.com/zh-cn/sellers/Emran%20Arts,CC BY-NC-SA 4.0,,
77,0_Leather_sofa,"2.919,1.203,0.988","棕色皮革切斯特菲尔德沙发,配有菱形绗缝软垫",A brown leather Chesterfield sofa with diamond tufted upholstery,多人沙发,Multi_person_sofa,凳椅沙发,Stool_chair_or_sofa,,SORTED_ANISOTROPIC,0,0,https://www.fab.com/zh-cn/listings/f7a6e726-d9ab-4fad-843f-d28b622b78d0,NextLevel3D,https://www.fab.com/zh-cn/sellers/Next%20Level%203D,CC BY-NC-SA 4.0,,
88,0_Modern_sofa,"3.830,1.291,1.102",带两个蓝色靠枕和一个珊瑚红靠枕的白色多人沙发,A white multi-person sofa with two blue cushions and one coral red cushion,多人沙发,Multi_person_sofa,凳椅沙发,Stool_chair_or_sofa,,SORTED_ANISOTROPIC,0,1,https://www.fab.com/zh-cn/listings/f7a6e726-d9ab-4fad-843f-d28b622b78d0,NextLevel3D,https://www.fab.com/zh-cn/sellers/Next%20Level%203D,CC BY-NC-SA 4.0,,
238,0_SM_Sofa_1,"3.807,3.009,0.844",带灰色装饰靠枕的米色模块化组合沙发,Beige modular sectional sofa with gray accent pillows,多人沙发,Multi_person_sofa,凳椅沙发,Stool_chair_or_sofa,,SORTED_ANISOTROPIC,0,1,https://www.fab.com/listings/ce90085d-3f46-456e-b436-f1fa48081be4,NextLevel3D,https://www.fab.com/zh-cn/sellers/Next%20Level%203D,CC BY-NC-SA 4.0,,
240,0_SM_Sofa_2,"2.762,1.042,0.856",米色布艺沙发配绿色装饰靠枕和扶手,Beige fabric sofa with green decorative cushions and armrests,多人沙发,Multi_person_sofa,凳椅沙发,Stool_chair_or_sofa,,SORTED_ANISOTROPIC,0,1,https://www.fab.com/listings/ce90085d-3f46-456e-b436-f1fa48081be4,NextLevel3D,https://www.fab.com/zh-cn/sellers/Next%20Level%203D,CC BY-NC-SA 4.0,,
253,0_sofa_01_2k_packed,"1.571,0.658,0.797",带有深色木质镶边和华丽曲线靠背的米色软垫沙发,A beige upholstered sofa with ornate curved backrest and dark wood trim,多人沙发,Multi_person_sofa,凳椅沙发,Stool_chair_or_sofa,,SORTED_ANISOTROPIC,0,0,https://polyhaven.com/a/Sofa_01,Kirill Sannikov,https://polyhaven.com/all?a=Kirill%20Sannikov,CC BY-NC-SA 4.0,,
254,0_sofa_02_2k_packed,"1.807,0.818,0.709",深灰色拉扣软包曲木腿沙发,A dark gray tufted sofa with curved wooden legs,多人沙发,Multi_person_sofa,凳椅沙发,Stool_chair_or_sofa,,SORTED_ANISOTROPIC,0,0,https://polyhaven.com/a/sofa_02,Kirill Sannikov,https://polyhaven.com/all?a=Kirill%20Sannikov,CC BY-NC-SA 4.0,,
255,0_sofa_03_2k_packed,"2.731,0.925,1.118",棕色皮革沙发配米色花纹靠垫和卷臂扶手,Brown leather sofa with beige floral cushions and rolled arms,多人沙发,Multi_person_sofa,凳椅沙发,Stool_chair_or_sofa,,SORTED_ANISOTROPIC,0,1,https://polyhaven.com/a/sofa_03,Fran Calvente,https://polyhaven.com/all?a=Fran%20Calvente,CC BY-NC-SA 4.0,,
409,15_SM_Sofa,"2.272,0.933,0.884",深灰色织物面料金属框架底座现代沙发,A modern dark gray fabric sofa with metal frame base,多人沙发,Multi_person_sofa,凳椅沙发,Stool_chair_or_sofa,,SORTED_ANISOTROPIC,0,0,https://www.fab.com/zh-cn/listings/7d0ba3e2-b243-4ec9-bbe3-a3059dc3bc37,NextLevel3D,https://www.fab.com/zh-cn/sellers/Next%20Level%203D,CC BY-NC-SA 4.0,,
523,20_SM_Sofa,"2.270,0.935,0.833",浅灰色绗缝软包沙发配深灰色靠枕,Light gray tufted sofa with quilted upholstery and dark gray cushions,多人沙发,Multi_person_sofa,凳椅沙发,Stool_chair_or_sofa,,SORTED_ANISOTROPIC,0,0,https://www.fab.com/zh-cn/listings/5315e021-834d-48b0-b916-b4063cb25fc0,NextLevel3D,https://www.fab.com/zh-cn/sellers/Next%20Level%203D,CC BY-NC-SA 4.0,,
575,22_SM_Bench_Padded_NN_01a,"1.902,0.669,0.835",木框架沙发配黄色几何菱形图案靠垫,A wooden-framed sofa with yellow geometric patterned cushions and diamond motifs,多人沙发,Multi_person_sofa,凳椅沙发,Stool_chair_or_sofa,,SORTED_ANISOTROPIC,0,0,https://www.fab.com/zh-cn/listings/fecd3afb-683c-4eb0-8ef8-4ecb99871452,Dekogon Studios,https://www.fab.com/zh-cn/sellers/Dekogon%20Studios,CC BY-NC-SA 4.0,,
1142,a_LeatherSofa,"2.372,0.857,0.975",深棕色三人位卷臂软垫沙发,Dark brown three-seater sofa with rolled arms and cushioned seats,多人沙发,Multi_person_sofa,凳椅沙发,Stool_chair_or_sofa,,SORTED_ANISOTROPIC,0,0,"https://www.fab.com/listings/c3148cbb-4b57-4f09-a749-636bc0fe2da2

https://www.fab.com/listings/82e8f9af-843d-46c4-ae16-c6aee0ed4eaa

https://www.fab.com/listings/f3b2aa27-c8be-4987-b8a2-81adf0fe85a8

https://www.fab.com/listings/b5603e44-e1b0-4346-9c3d-04887aa9f87d",SilverTm,https://www.fab.com/zh-cn/sellers/SilverTm,CC BY-NC-SA 4.0,,
1691,a_SM_sofa,"2.555,1.049,1.143",磨损陈旧的灰色三人布艺沙发,Worn gray three-seater sofa with distressed fabric texture,多人沙发,Multi_person_sofa,凳椅沙发,Stool_chair_or_sofa,,SORTED_ANISOTROPIC,0,0,https://www.fab.com/listings/0c106ab4-e1cd-40c2-8731-b7940e52b4b6,EmranArts,https://www.fab.com/zh-cn/sellers/Emran%20Arts,CC BY-NC-SA 4.0,abort,
1692,a_SM_Sofa_01a,"2.423,0.968,1.068",深棕色三人沙发，带卷边扶手和锥形腿,A dark brown three-seater sofa with rolled arms and tapered legs,多人沙发,Multi_person_sofa,凳椅沙发,Stool_chair_or_sofa,,SORTED_ANISOTROPIC,0,0,Imaginarium Group,Imaginarium Group,https://ydove0324.github.io/Imaginarium/,CC BY-NC-SA 4.0,,
1695,a_SM_Sofa_07,"3.031,1.218,0.942",深灰色切斯特菲尔德沙发，带拉扣靠背和卷边扶手,A dark gray Chesterfield sofa with tufted back and rolled arms,多人沙发,Multi_person_sofa,凳椅沙发,Stool_chair_or_sofa,,SORTED_ANISOTROPIC,0,0,Imaginarium Group,Imaginarium Group,https://ydove0324.github.io/Imaginarium/,CC BY-NC-SA 4.0,,
1858,b_108,"2.843,0.952,0.791",灰褐色皮质三人沙发配金属腿,Modern taupe leather three-seater sofa with metal legs,多人沙发,Multi_person_sofa,凳椅沙发,Stool_chair_or_sofa,,SORTED_ANISOTROPIC,0,0,3D Future Dataset,3D Future Dataset,https://tianchi.aliyun.com/dataset/98063,CC BY-NC-SA 4.0,,
1872,b_19,"2.796,1.219,0.838",带深灰色靠枕的鼠尾草绿色绗缝弧形沙发,A curved tufted sofa in sage green fabric with dark gray accent pillow,多人沙发,Multi_person_sofa,凳椅沙发,Stool_chair_or_sofa,,SORTED_ANISOTROPIC,0,0,3D Future Dataset,3D Future Dataset,https://tianchi.aliyun.com/dataset/98063,CC BY-NC-SA 4.0,,
1880,b_27,"3.211,1.018,0.784",深灰色现代长沙发配米色和深色装饰靠垫,Long charcoal gray modern sofa with beige and dark accent pillows,多人沙发,Multi_person_sofa,凳椅沙发,Stool_chair_or_sofa,,SORTED_ANISOTROPIC,0,1,3D Future Dataset,3D Future Dataset,https://tianchi.aliyun.com/dataset/98063,CC BY-NC-SA 4.0,,
1888,b_34,"2.324,0.926,0.911",深灰色天鹅绒拉扣软垫双人沙发配抱枕,Dark gray velvet sofa with tufted cushions and throw pillows,多人沙发,Multi_person_sofa,凳椅沙发,Stool_chair_or_sofa,,SORTED_ANISOTROPIC,0,1,3D Future Dataset,3D Future Dataset,https://tianchi.aliyun.com/dataset/98063,CC BY-NC-SA 4.0,,
1893,b_39,"2.075,0.846,0.844",灰褐色布艺沙发配花卉和纯色靠垫及金属腿,Taupe fabric sofa with floral and solid cushions on metal legs,多人沙发,Multi_person_sofa,凳椅沙发,Stool_chair_or_sofa,,SORTED_ANISOTROPIC,0,1,3D Future Dataset,3D Future Dataset,https://tianchi.aliyun.com/dataset/98063,CC BY-NC-SA 4.0,,
1911,b_58,"2.259,0.809,0.682","棕色皮质贵妃榻沙发,配黑色金属角架和扣点软垫",Brown leather daybed sofa with angular black metal frame and tufted cushions,多人沙发,Multi_person_sofa,凳椅沙发,Stool_chair_or_sofa,,SORTED_ANISOTROPIC,0,0,3D Future Dataset,3D Future Dataset,https://tianchi.aliyun.com/dataset/98063,CC BY-NC-SA 4.0,,
1917,b_66,"1.872,0.993,0.835","深青色布艺沙发,配可调节靠背和条纹装饰抱枕",Dark teal fabric sofa with adjustable backrest and striped decorative pillows,多人沙发,Multi_person_sofa,凳椅沙发,Stool_chair_or_sofa,,SORTED_ANISOTROPIC,0,1,3D Future Dataset,3D Future Dataset,https://tianchi.aliyun.com/dataset/98063,CC BY-NC-SA 4.0,,
1920,b_69,"1.528,0.635,0.662",灰色纹理布艺沙发配两个米色波点抱枕,Gray textured fabric sofa with two beige polka dot cushions,多人沙发,Multi_person_sofa,凳椅沙发,Stool_chair_or_sofa,,SORTED_ANISOTROPIC,0,1,3D Future Dataset,3D Future Dataset,https://tianchi.aliyun.com/dataset/98063,CC BY-NC-SA 4.0,,
1924,b_74,"2.972,1.094,0.829","黑色皮质多人沙发,配圆柱形扶手和靠垫",Black leather multi-person sofa with cylindrical armrests and cushions,多人沙发,Multi_person_sofa,凳椅沙发,Stool_chair_or_sofa,,SORTED_ANISOTROPIC,0,0,3D Future Dataset,3D Future Dataset,https://tianchi.aliyun.com/dataset/98063,CC BY-NC-SA 4.0,,
1928,b_79,"2.550,0.939,0.841",灰色三人沙发配棕色木质扶手和黄棕色靠垫,Gray three-seater sofa with tan wooden sides and yellow and brown cushions,多人沙发,Multi_person_sofa,凳椅沙发,Stool_chair_or_sofa,,SORTED_ANISOTROPIC,0,1,3D Future Dataset,3D Future Dataset,https://tianchi.aliyun.com/dataset/98063,CC BY-NC-SA 4.0,,
1930,b_80,"2.109,0.961,0.797",带棕色抱枕和裙摆式底座的浅灰色布艺沙发,Light gray upholstered sofa with brown throw pillows and skirted base,多人沙发,Multi_person_sofa,凳椅沙发,Stool_chair_or_sofa,,SORTED_ANISOTROPIC,0,1,3D Future Dataset,3D Future Dataset,https://tianchi.aliyun.com/dataset/98063,CC BY-NC-SA 4.0,,
1933,b_83,"2.526,0.942,0.847",灰色三人沙发带侧边储物袋和靠垫,Gray three-seater sofa with side storage pockets and throw pillows,多人沙发,Multi_person_sofa,凳椅沙发,Stool_chair_or_sofa,,SORTED_ANISOTROPIC,0,0,3D Future Dataset,3D Future Dataset,https://tianchi.aliyun.com/dataset/98063,CC BY-NC-SA 4.0,,
1960,d_1000001663252,"3.324,2.452,0.891",橄榄棕色编织面料L型转角沙发配木质腿,L-shaped sectional sofa in olive brown woven fabric with wooden legs,多人沙发,Multi_person_sofa,凳椅沙发,Stool_chair_or_sofa,,SORTED_ANISOTROPIC,0,1,Imaginarium Group,Imaginarium Group,https://ydove0324.github.io/Imaginarium/,CC BY-NC-SA 4.0,,
1978,d_1000003655840,"2.993,1.471,0.859",深灰色L型转角沙发，配细金属腿，现代简约风格,A dark gray L-shaped sectional sofa with slim metal legs and modern minimalist design,多人沙发,Multi_person_sofa,凳椅沙发,Stool_chair_or_sofa,,SORTED_ANISOTROPIC,0,0,Imaginarium Group,Imaginarium Group,https://ydove0324.github.io/Imaginarium/,CC BY-NC-SA 4.0,,
789,44_sk15_KidEasel01,"0.607,0.758,1.281",带双面画纸、颜料托盘和彩色画作的木质儿童画架,"A wooden children's easel with dual paper sheets, paint tray, and colorful artwork",儿童画架,Children_easel,画架,Easel,,ISOTROPIC,0,0,https://sketchfab.com/3d-models/kids-easel-e0d7dd1475df4c8bb666c1c8884fea17,Alec Huxley,https://sketchfab.com/alechuxley,CC BY-NC-SA 4.0,,
832,44_sk55_Bike02,"1.150,0.489,0.680",深灰色平衡车配棕色皮质座椅和充气轮胎,A dark gray balance bike with brown leather seat and pneumatic tires,儿童三轮车,Children_tricycle,玩具,Toy,,ISOTROPIC,0,0,https://sketchfab.com/3d-models/bikestar-kid-bike-d7444374089d44f1a2f579b186250766,Polymount,https://sketchfab.com/soni.ravi206,CC BY-NC-SA 4.0,,
604,23_SM_Nutcrackers_NN_01a,"0.158,0.151,0.460",身穿蓝色制服、黄色裤子和灰色头盔的传统胡桃夹子士兵玩偶,"A traditional nutcracker soldier figurine with blue uniform, yellow pants, and gray helmet",儿童玩具,Children_toy,玩具,Toy,,ISOTROPIC,0,0,https://www.fab.com/zh-cn/listings/43965ec3-e403-4c70-91a2-8f60b336920f,Dekogon Studios,https://www.fab.com/zh-cn/sellers/Dekogon%20Studios,CC BY-NC-SA 4.0,,
605,23_SM_Nutcrackers_NN_01b,"0.144,0.180,0.466",传统木制胡桃夹子士兵，红色外套，粉色面部，高黑帽,"A traditional wooden nutcracker soldier with red coat, pink face, and tall black hat",儿童玩具,Children_toy,玩具,Toy,,ISOTROPIC,0,0,https://www.fab.com/zh-cn/listings/43965ec3-e403-4c70-91a2-8f60b336920f,Dekogon Studios,https://www.fab.com/zh-cn/sellers/Dekogon%20Studios,CC BY-NC-SA 4.0,,
606,23_SM_Nutcrackers_NN_01c,"0.155,0.177,0.443",穿灰色帽子、红色上衣和蓝色裤子的木制胡桃夹子玩偶，手持绳索,"A wooden nutcracker figurine wearing gray hat, red jacket, and blue pants holding rope",儿童玩具,Children_toy,玩具,Toy,,ISOTROPIC,0,0,https://www.fab.com/zh-cn/listings/43965ec3-e403-4c70-91a2-8f60b336920f,Dekogon Studios,https://www.fab.com/zh-cn/sellers/Dekogon%20Studios,CC BY-NC-SA 4.0,,
